objectid,transcript_line,start,end,speaker,text,txt_filename
mainstreet033,222,00:30:36.210,00:30:45.720,Monique Lillard,"He went to the library, the public library, I mean and i'm asking about renting movies from the library actually never mentioned division library, but I didn't.",2021-05-07_elijahting_jessicaryanwilcox_videostore_transcript.vtt
mainstreet033,223,00:30:46.320,00:30:54.210,Monique Lillard,"hear you can you could recreate that experience, except, you have to keep it quiet because it's a library great I love that even more.",2021-05-07_elijahting_jessicaryanwilcox_videostore_transcript.vtt
mainstreet033,224,00:31:01.830,00:31:04.680,Monique Lillard,"Remember, like yelling at each other in the store and you and I have a really.",2021-05-07_elijahting_jessicaryanwilcox_videostore_transcript.vtt
mainstreet033,225,00:31:08.970,00:31:12.330,Monique Lillard,"Nice to go there with other people, all together, like it.",2021-05-07_elijahting_jessicaryanwilcox_videostore_transcript.vtt
mainstreet033,226,00:31:13.140,00:31:21.120,Monique Lillard,"We used to watch the movies on the lawn, and so we get we have they tell about that Okay, so we have this like a big net sort of thing.",2021-05-07_elijahting_jessicaryanwilcox_videostore_transcript.vtt
mainstreet033,227,00:31:21.360,00:31:30.810,Monique Lillard,And we put this white grape over it on and then kind of clip it to the net to make it stand big separate yeah so then we get those like little table and put a projector on it.,2021-05-07_elijahting_jessicaryanwilcox_videostore_transcript.vtt
mainstreet033,228,00:31:31.770,00:31:35.040,Monique Lillard,"So it'd be projecting on it so, then we have the computer hook, the computer up.",2021-05-07_elijahting_jessicaryanwilcox_videostore_transcript.vtt
mainstreet033,229,00:31:35.610,00:31:44.040,Monique Lillard,And we'd slide the disc into the computer so used to like we used to bring friends over would go down to like the dollar store or something and get snacks for everyone.,2021-05-07_elijahting_jessicaryanwilcox_videostore_transcript.vtt
mainstreet033,230,00:31:44.550,00:31:55.440,Monique Lillard,"We all go down, and then we go down to Howard Hughes a PIC and movie and then we invite people over and we'd ask them if they wanted to watch the movie with us and we watched that movie on the line altogether.",2021-05-07_elijahting_jessicaryanwilcox_videostore_transcript.vtt
mainstreet033,231,00:31:56.910,00:32:03.810,Monique Lillard,"That was a lot of fun, we used to do like the things like the the dog make it it's like.",2021-05-07_elijahting_jessicaryanwilcox_videostore_transcript.vtt
mainstreet033,232,00:32:05.070,00:32:17.490,Monique Lillard,The duck the duck the duck duck so like the little hands figures like hand puppets Austrians yeah put them over the projector yeah he's have like shadow fights almost on the projector.,2021-05-07_elijahting_jessicaryanwilcox_videostore_transcript.vtt
mainstreet033,233,00:32:18.240,00:32:25.950,Monique Lillard,Like it was if you go really close to like the projector aren't even really far away and you'd have like your shadow showing on it.,2021-05-07_elijahting_jessicaryanwilcox_videostore_transcript.vtt
mainstreet033,234,00:32:26.430,00:32:39.240,Monique Lillard,"and whatever instead of hitting each other physically we attack each other the shadows, while the movie is flying and I know everyone i'd be like study and if you're sitting reading for another potential to we'd have with the blankets and you lift your head up they'd be like.",2021-05-07_elijahting_jessicaryanwilcox_videostore_transcript.vtt
mainstreet033,235,00:32:40.980,00:32:44.760,Monique Lillard,yellow here in the middle of the movie yeah um.,2021-05-07_elijahting_jessicaryanwilcox_videostore_transcript.vtt
mainstreet033,236,00:32:46.530,00:32:54.150,Monique Lillard,I remember one time we got like this dinosaur one I think you were there for that one of the times Kim came over.,2021-05-07_elijahting_jessicaryanwilcox_videostore_transcript.vtt
mainstreet033,237,00:32:55.500,00:32:58.170,Monique Lillard,And we will watch this dinosaur movie.,2021-05-07_elijahting_jessicaryanwilcox_videostore_transcript.vtt
mainstreet033,238,00:32:59.340,00:33:13.800,Monique Lillard,"Jurassic Park, I got super scared now, as I asked her to come, and so I ended up going to sleep with her, because I don't want to watch the movie it was scary not really very suspenseful garage which really freaky.",2021-05-07_elijahting_jessicaryanwilcox_videostore_transcript.vtt
mainstreet033,239,00:33:15.480,00:33:17.190,Monique Lillard,i'm trying to think of anything.,2021-05-07_elijahting_jessicaryanwilcox_videostore_transcript.vtt
mainstreet033,240,00:33:18.360,00:33:19.140,Monique Lillard,or the other.,2021-05-07_elijahting_jessicaryanwilcox_videostore_transcript.vtt
mainstreet033,241,00:33:20.940,00:33:29.130,Monique Lillard,"If we hook up a computer to it, we can we can't come get a disconnect though now the computers Now you can get a disk in them.",2021-05-07_elijahting_jessicaryanwilcox_videostore_transcript.vtt
mainstreet033,242,00:33:30.300,00:33:38.790,Monique Lillard,So used to have to just connect the computer of man likes like the projector with all the wires and then press play.,2021-05-07_elijahting_jessicaryanwilcox_videostore_transcript.vtt
mainstreet033,243,00:33:40.980,00:33:42.840,Monique Lillard,But yeah.,2021-05-07_elijahting_jessicaryanwilcox_videostore_transcript.vtt
mainstreet033,244,00:33:45.300,00:33:46.320,Monique Lillard,Good good.,2021-05-07_elijahting_jessicaryanwilcox_videostore_transcript.vtt
mainstreet033,245,00:33:47.460,00:33:48.180,Monique Lillard,Can you give me.,2021-05-07_elijahting_jessicaryanwilcox_videostore_transcript.vtt
mainstreet033,246,00:33:53.250,00:33:57.930,Monique Lillard,My cat was just jumping up and laughing their parents flying all around from the CAP so.,2021-05-07_elijahting_jessicaryanwilcox_videostore_transcript.vtt
mainstreet033,247,00:33:59.220,00:34:07.290,Monique Lillard,yeah my nose a little stuffy you know allergies are the best yeah there you go yeah okay any other memories.,2021-05-07_elijahting_jessicaryanwilcox_videostore_transcript.vtt
mainstreet033,248,00:34:08.520,00:34:20.040,Monique Lillard,"We can think of anything else okay Okay, then I want to thank you and i'm going to stop the recording and then we'll talk for a second okay all right let's.",2021-05-07_elijahting_jessicaryanwilcox_videostore_transcript.vtt
mainstreet033,249,00:34:25.650,00:34:26.340,Monique Lillard,Do it right.,2021-05-07_elijahting_jessicaryanwilcox_videostore_transcript.vtt
mainstreet033,250,00:34:27.540,00:34:31.380,Monique Lillard,"To be positive for for stock that well, we can pause it will start with positive.",2021-05-07_elijahting_jessicaryanwilcox_videostore_transcript.vtt
mainstreet033,251,00:34:34.530,00:34:44.310,Monique Lillard,"Okay hold on one second it does something no it's Okay, I actually do I remember one time, I tried to sneak behind the counter and you guys were yelling at me I was.",2021-05-07_elijahting_jessicaryanwilcox_videostore_transcript.vtt
mainstreet033,252,00:34:44.820,00:34:54.810,Monique Lillard,"tiny, tiny now so i'm like the size of the counter I can really reach over it's like crawl back behind it and try to act like the cashier when you guys are having movies, when the person.",2021-05-07_elijahting_jessicaryanwilcox_videostore_transcript.vtt
mainstreet033,253,00:34:55.350,00:35:09.510,Monique Lillard,"The person was back there with the movies getting one for us and I kind of just sit there, and you guys were all telling me to get out of there and I was like what's wrong I was very confused and I think Ben Ben maybe maybe there's even dead lifted me over the counter.",2021-05-07_elijahting_jessicaryanwilcox_videostore_transcript.vtt
mainstreet033,254,00:35:10.800,00:35:11.400,Monique Lillard,me up.,2021-05-07_elijahting_jessicaryanwilcox_videostore_transcript.vtt
mainstreet033,255,00:35:12.810,00:35:13.200,Monique Lillard,yeah.,2021-05-07_elijahting_jessicaryanwilcox_videostore_transcript.vtt
mainstreet033,256,00:35:15.510,00:35:21.900,Monique Lillard,"Anything else that might have, and you can always add to this, we can you can come over, we can do this again so.",2021-05-07_elijahting_jessicaryanwilcox_videostore_transcript.vtt
mainstreet033,257,00:35:22.950,00:35:31.620,Monique Lillard,"yeah yeah what what's happening, a lot of people think about it, then APP that sort of stirs up memories and then I wish I had said that and then that is absolutely no problem.",2021-05-07_elijahting_jessicaryanwilcox_videostore_transcript.vtt
mainstreet033,258,00:35:32.880,00:35:33.090,,yeah.,2021-05-07_elijahting_jessicaryanwilcox_videostore_transcript.vtt
mainstreet033,259,00:35:35.010,00:35:41.280,Monique Lillard,"Alright, so we end up for now I can you see my day i'm going to pause it for.",2021-05-07_elijahting_jessicaryanwilcox_videostore_transcript.vtt
