objectid,transcript_line,start,end,speaker,text,txt_filename
mainstreet033,110,00:15:31.350,00:15:48.780,Monique Lillard,"I know we use that a lot quite a lot, so I was very invested in that, so I like that place I can't I don't know about anybody else really i'm from yeah but for me personally, or I guess us personally, it was pretty important for us, since we go there to get all of our movies.",2021-05-07_elijahting_jessicaryanwilcox_videostore_transcript.vtt
mainstreet033,111,00:15:50.490,00:15:51.480,Monique Lillard,And I think are.,2021-05-07_elijahting_jessicaryanwilcox_videostore_transcript.vtt
mainstreet033,112,00:15:52.500,00:15:52.890,Monique Lillard,The.,2021-05-07_elijahting_jessicaryanwilcox_videostore_transcript.vtt
mainstreet033,113,00:15:54.120,00:15:57.720,Monique Lillard,Word variety of movies only watch now and shows up definitely short.,2021-05-07_elijahting_jessicaryanwilcox_videostore_transcript.vtt
mainstreet033,114,00:15:59.130,00:15:59.610,Monique Lillard,yeah.,2021-05-07_elijahting_jessicaryanwilcox_videostore_transcript.vtt
mainstreet033,115,00:16:00.840,00:16:03.420,Monique Lillard,"yeah we, I think.",2021-05-07_elijahting_jessicaryanwilcox_videostore_transcript.vtt
mainstreet033,116,00:16:04.800,00:16:12.090,Monique Lillard,Though those places and things that support good family time are important and.,2021-05-07_elijahting_jessicaryanwilcox_videostore_transcript.vtt
mainstreet033,117,00:16:14.190,00:16:33.780,Monique Lillard,"That was one that's what it did for us spent a lot of time, you know will yeah, all in all, a lot of time planning shopping watching debating yeah talking about movies later so they're definitely going to finish, so if you compare it to.",2021-05-07_elijahting_jessicaryanwilcox_videostore_transcript.vtt
mainstreet033,118,00:16:35.220,00:16:47.460,Monique Lillard,"So I have an account, I know you scroll through to pick the movie I don't even know what you do with prime, how do you do it, you put in the name of the movie or it's kind of the same as netflix you can search it, it has like no Hana wrote here kid.",2021-05-07_elijahting_jessicaryanwilcox_videostore_transcript.vtt
mainstreet033,119,00:16:49.380,00:16:51.360,Monique Lillard,We basically has what you.,2021-05-07_elijahting_jessicaryanwilcox_videostore_transcript.vtt
mainstreet033,120,00:16:52.800,00:16:55.770,Monique Lillard,Keep watching a watch again.,2021-05-07_elijahting_jessicaryanwilcox_videostore_transcript.vtt
mainstreet033,121,00:16:57.360,00:17:05.790,Monique Lillard,recommended and then kind of like what everyone else is watching so kind of like worldwide is what everyone else likes to watch the like.,2021-05-07_elijahting_jessicaryanwilcox_videostore_transcript.vtt
mainstreet033,122,00:17:06.870,00:17:07.590,Monique Lillard,I didn't even know.,2021-05-07_elijahting_jessicaryanwilcox_videostore_transcript.vtt
mainstreet033,123,00:17:09.390,00:17:11.580,Monique Lillard,"I mean we only watch, I know I know.",2021-05-07_elijahting_jessicaryanwilcox_videostore_transcript.vtt
mainstreet033,124,00:17:13.200,00:17:21.930,Monique Lillard,"I can have on the watch something conservative, we only watch the movies watch kind of Illinois new episodes coming out in like a lot of the shows that we watch.",2021-05-07_elijahting_jessicaryanwilcox_videostore_transcript.vtt
mainstreet033,125,00:17:23.220,00:17:27.870,Monique Lillard,"So, usually we just keep watching the show So what do you want from now it's like.",2021-05-07_elijahting_jessicaryanwilcox_videostore_transcript.vtt
mainstreet033,126,00:17:29.670,00:17:33.930,Monique Lillard,"sacred, so I been watching that movie and show.",2021-05-07_elijahting_jessicaryanwilcox_videostore_transcript.vtt
mainstreet033,127,00:17:34.980,00:17:39.720,Monique Lillard,With sin sky and then my oldest 25 and 22.,2021-05-07_elijahting_jessicaryanwilcox_videostore_transcript.vtt
mainstreet033,128,00:17:41.040,00:17:48.600,Monique Lillard,Since they they were the ones that kind of started and then so it trickled down to my younger kids and.,2021-05-07_elijahting_jessicaryanwilcox_videostore_transcript.vtt
mainstreet033,129,00:17:50.400,00:17:58.770,Monique Lillard,"Pretty universally funny we want in the past, like since the beginning of the school year so like October September.",2021-05-07_elijahting_jessicaryanwilcox_videostore_transcript.vtt
mainstreet033,130,00:18:00.360,00:18:07.170,Monique Lillard,"We have watched like finished it all the way through all eight seasons, I am not included in.",2021-05-07_elijahting_jessicaryanwilcox_videostore_transcript.vtt
mainstreet033,131,00:18:10.770,00:18:25.560,Monique Lillard,"Washington seven or eight different time wow just because we playing games or doing homework, or something and we just have it playing in the background, so we have like kind of most of the words at all if it's like a cop show most.",2021-05-07_elijahting_jessicaryanwilcox_videostore_transcript.vtt
mainstreet033,132,00:18:27.990,00:18:31.770,Monique Lillard,likely details memorize what we kind of just washing the backup anyway.,2021-05-07_elijahting_jessicaryanwilcox_videostore_transcript.vtt
mainstreet033,133,00:18:33.870,00:18:38.370,Monique Lillard,and launch like an episode every night bob's burgers has been a lot of entertainment.,2021-05-07_elijahting_jessicaryanwilcox_videostore_transcript.vtt
mainstreet033,134,00:18:40.260,00:18:43.470,Monique Lillard,Those ones are still coming out yeah that's cool yeah brooklyn.,2021-05-07_elijahting_jessicaryanwilcox_videostore_transcript.vtt
mainstreet033,135,00:18:45.180,00:19:02.910,Monique Lillard,"brooklyn nine nine we are watching for a while, because they took or they took psycho yeah So if I try to find another detective show wonder brooklyn nine nine and then kind of transferred over to bob's burgers but, since both keep having new episodes we kind of just went between them.",2021-05-07_elijahting_jessicaryanwilcox_videostore_transcript.vtt
mainstreet033,136,00:19:03.960,00:19:14.070,Monique Lillard,"So, but how is the experience different on the netflix or the Amazon, as opposed to going into the movie store it's a lot different I think going into the new stores, a lot more.",2021-05-07_elijahting_jessicaryanwilcox_videostore_transcript.vtt
mainstreet033,137,00:19:15.480,00:19:16.080,Monique Lillard,what's the word.,2021-05-07_elijahting_jessicaryanwilcox_videostore_transcript.vtt
mainstreet033,138,00:19:17.820,00:19:23.130,Monique Lillard,"I want to say, like interaction, but like and interactive interactive I guess that would be.",2021-05-07_elijahting_jessicaryanwilcox_videostore_transcript.vtt
mainstreet033,139,00:19:24.510,00:19:34.650,Monique Lillard,"yeah um yeah we kind of go around on looking at the looking around and be like our whole family, instead of just like me, I guess, just putting on an episode.",2021-05-07_elijahting_jessicaryanwilcox_videostore_transcript.vtt
mainstreet033,140,00:19:35.910,00:19:48.330,Monique Lillard,"We were all debate pick like multiple different movies have specific nights for me watch the movies and we'd all crowd down as a family together and, like the basement with the big TV was couches, which was a lot of fun with those movies.",2021-05-07_elijahting_jessicaryanwilcox_videostore_transcript.vtt
mainstreet033,141,00:19:49.410,00:19:55.080,Monique Lillard,Since I say they have some really good ones which a lot of the police are a lot of the sites that TV doesn't have anyone.,2021-05-07_elijahting_jessicaryanwilcox_videostore_transcript.vtt
mainstreet033,142,00:19:58.230,00:20:04.230,Monique Lillard,"yeah I if I had to choose, I think I probably still would have preferred the power of us.",2021-05-07_elijahting_jessicaryanwilcox_videostore_transcript.vtt
mainstreet033,143,00:20:05.640,00:20:14.430,Monique Lillard,"I would probably spend a lot more money on the psychs then since I kept thinking man, and now we just own them you really should have just bought it yeah I should.",2021-05-07_elijahting_jessicaryanwilcox_videostore_transcript.vtt
mainstreet033,144,00:20:15.810,00:20:16.230,Monique Lillard,Go.,2021-05-07_elijahting_jessicaryanwilcox_videostore_transcript.vtt
mainstreet033,145,00:20:17.610,00:20:19.770,Monique Lillard,store personnel that people work there.,2021-05-07_elijahting_jessicaryanwilcox_videostore_transcript.vtt
mainstreet033,146,00:20:26.370,00:20:28.680,Monique Lillard,"Over the years, yeah yeah and.",2021-05-07_elijahting_jessicaryanwilcox_videostore_transcript.vtt
mainstreet033,147,00:20:29.730,00:20:31.590,Monique Lillard,They have long term in place and.,2021-05-07_elijahting_jessicaryanwilcox_videostore_transcript.vtt
mainstreet033,148,00:20:32.610,00:20:40.110,Monique Lillard,Louise a great I over all these you know 27 years never was always a wonderful experience.,2021-05-07_elijahting_jessicaryanwilcox_videostore_transcript.vtt
mainstreet033,149,00:20:41.700,00:20:48.180,Monique Lillard,And you see you know all the townies so it was just almost always kind of a fun thing.,2021-05-07_elijahting_jessicaryanwilcox_videostore_transcript.vtt
mainstreet033,150,00:20:50.100,00:20:55.110,Monique Lillard,And when did you learn that the store was closing and how did you feel about it.,2021-05-07_elijahting_jessicaryanwilcox_videostore_transcript.vtt
mainstreet033,151,00:20:57.060,00:21:00.330,Monique Lillard,I guess found a closed and was like.,2021-05-07_elijahting_jessicaryanwilcox_videostore_transcript.vtt
mainstreet033,152,00:21:04.410,00:21:11.970,Monique Lillard,"Only notice, I think I got like a forewarning but I never really paid attention to it just because i've had it since i've been born there.",2021-05-07_elijahting_jessicaryanwilcox_videostore_transcript.vtt
mainstreet033,153,00:21:13.410,00:21:24.510,Monique Lillard,"I didn't really think twice thought I was going to be like it's not going to happen, but it did, and we are video prime but even then like they didn't have all the good stuff that that please had.",2021-05-07_elijahting_jessicaryanwilcox_videostore_transcript.vtt
mainstreet033,154,00:21:25.560,00:21:33.600,Monique Lillard,"So disappoint me thinking we probably watch more shows and movies, without Howard Hughes.",2021-05-07_elijahting_jessicaryanwilcox_videostore_transcript.vtt
mainstreet033,155,00:21:35.850,00:21:46.680,Monique Lillard,yeah because you know somehow we just don't ever kind of like a late all agree on a movie and land on one yeah a lot of the time to for video prime used to watch.,2021-05-07_elijahting_jessicaryanwilcox_videostore_transcript.vtt
mainstreet033,156,00:21:47.250,00:21:57.030,Monique Lillard,"It all seems like thought like there's no with our with our main ah, then yeah so anyway, we should be able to get like multiple different.",2021-05-07_elijahting_jessicaryanwilcox_videostore_transcript.vtt
mainstreet033,157,00:21:58.560,00:22:00.060,Monique Lillard,keep going i'm going to make sure that.,2021-05-07_elijahting_jessicaryanwilcox_videostore_transcript.vtt
mainstreet033,158,00:22:01.410,00:22:13.620,Monique Lillard,"Like multiple different types of movies that sometimes the parents will watch specifically and then, when we all watch together and then ones that like one of the parents would monitor and sitting with us for like the cancer mainly just be interacting.",2021-05-07_elijahting_jessicaryanwilcox_videostore_transcript.vtt
mainstreet033,159,00:22:14.850,00:22:15.930,Monique Lillard,i'm.,2021-05-07_elijahting_jessicaryanwilcox_videostore_transcript.vtt
mainstreet033,160,00:22:19.470,00:22:19.800,,thinking.,2021-05-07_elijahting_jessicaryanwilcox_videostore_transcript.vtt
mainstreet033,161,00:22:21.330,00:22:22.950,Monique Lillard,Why do you think the store closed.,2021-05-07_elijahting_jessicaryanwilcox_videostore_transcript.vtt
mainstreet033,162,00:22:27.120,00:22:32.220,Monique Lillard,Well okay right co but i'll say i'll say think it's something where but let's hear what your mom says first and then yeah.,2021-05-07_elijahting_jessicaryanwilcox_videostore_transcript.vtt
mainstreet033,163,00:22:33.630,00:22:35.100,Monique Lillard,"Oh, I think that it.",2021-05-07_elijahting_jessicaryanwilcox_videostore_transcript.vtt
mainstreet033,164,00:22:36.630,00:22:39.690,Monique Lillard,difficult for many of those.,2021-05-07_elijahting_jessicaryanwilcox_videostore_transcript.vtt
mainstreet033,165,00:22:41.430,00:22:57.540,Monique Lillard,"types of stores to stay open with with digitalization oh yeah same thing with all the new technology and like Disney plus came out and, like all the other places, that you can watch stuff all the different types of screens.",2021-05-07_elijahting_jessicaryanwilcox_videostore_transcript.vtt
mainstreet033,166,00:22:59.100,00:23:02.310,Monique Lillard,People stephanie stop renting stuff let more.,2021-05-07_elijahting_jessicaryanwilcox_videostore_transcript.vtt
mainstreet033,167,00:23:03.690,00:23:10.590,Monique Lillard,Or we didn't even like we want just like we went to the store constantly to work outside but that's about it and even towards.,2021-05-07_elijahting_jessicaryanwilcox_videostore_transcript.vtt
mainstreet033,168,00:23:12.570,00:23:16.170,Monique Lillard,"Towards the end I do think, at least for us.",2021-05-07_elijahting_jessicaryanwilcox_videostore_transcript.vtt
mainstreet033,169,00:23:17.670,00:23:25.110,Monique Lillard,"Personally, after a close, we definitely we want yeah like you said we started watching a lot less movies, what kind of just watched the same shows.",2021-05-07_elijahting_jessicaryanwilcox_videostore_transcript.vtt
mainstreet033,170,00:23:26.370,00:23:33.540,Monique Lillard,"When you said different kinds of screens because you're talking to the future here, you know who knows what can you describe what all those screens are.",2021-05-07_elijahting_jessicaryanwilcox_videostore_transcript.vtt
mainstreet033,171,00:23:33.840,00:23:49.020,Monique Lillard,"I mean a bunch of the new devices came out so there's like the handheld switch now, which is kind of like a portable it as like there's no, you can download a bunch of different watching shows like hulu and netflix on it, as long as you sign in you can watch on all those.",2021-05-07_elijahting_jessicaryanwilcox_videostore_transcript.vtt
mainstreet033,172,00:23:50.700,00:24:01.260,Monique Lillard,"phones, I remember towards the beginning when it first opened first November like even Lucas even had like a flip phone sky definitely had those recently about it.",2021-05-07_elijahting_jessicaryanwilcox_videostore_transcript.vtt
mainstreet033,173,00:24:02.010,00:24:11.400,Monique Lillard,"They weren't like they weren't like the or enough, there were they were iPods so they're more like the phones that we have now like iphones and Samsung galaxy all of those.",2021-05-07_elijahting_jessicaryanwilcox_videostore_transcript.vtt
mainstreet033,174,00:24:12.030,00:24:22.770,Monique Lillard,ones that have a lot more accessibility to all those things like I can download netflix and hulu and all the different Washington my phone when you can't do that on like the old phones that they used to have.,2021-05-07_elijahting_jessicaryanwilcox_videostore_transcript.vtt
mainstreet033,175,00:24:24.150,00:24:36.030,Monique Lillard,"or computers now even have a lot more like storage so yeah and you know what it just dawns on me, I mean because, as I said, I just think it's kind of fun I don't know who's gonna lose when.",2021-05-07_elijahting_jessicaryanwilcox_videostore_transcript.vtt
mainstreet033,176,00:24:36.450,00:24:46.470,Monique Lillard,"But, so this is, I guess, an old iPhone people are telling me it looks so small and stuff I mean two or three years ago we were in Europe and they couldn't believe how small our phones were.",2021-05-07_elijahting_jessicaryanwilcox_videostore_transcript.vtt
mainstreet033,177,00:24:46.710,00:24:53.730,Monique Lillard,But see oh good you've got one so look at that much bigger it is and that's the smallest one isn't it right.,2021-05-07_elijahting_jessicaryanwilcox_videostore_transcript.vtt
mainstreet033,178,00:24:57.060,00:24:59.850,Monique Lillard,"I don't know, but this isn't the case so it looks like.",2021-05-07_elijahting_jessicaryanwilcox_videostore_transcript.vtt
mainstreet033,179,00:25:00.900,00:25:16.470,Monique Lillard,"Oh that's true too yeah I can't get my case off of it right and then louie by my son who's 23 I guess you know, we should have said from the beginning that and Jessica has six children total and so they're all different.",2021-05-07_elijahting_jessicaryanwilcox_videostore_transcript.vtt
mainstreet033,180,00:25:18.630,00:25:22.200,Monique Lillard,"agents, obviously, so my son and.",2021-05-07_elijahting_jessicaryanwilcox_videostore_transcript.vtt
mainstreet033,181,00:25:23.820,00:25:26.820,Monique Lillard,JESSICA second oldest son eli's brother.,2021-05-07_elijahting_jessicaryanwilcox_videostore_transcript.vtt
mainstreet033,182,00:25:28.380,00:25:39.990,Monique Lillard,"Are 23 and they have a phone the even bigger than this now, and part of the reason is that they've watched them Oh, does he okay louie Okay, the phone that's like if this is my phone honestly.",2021-05-07_elijahting_jessicaryanwilcox_videostore_transcript.vtt
mainstreet033,183,00:25:43.110,00:25:51.600,Monique Lillard,"yeah i've seen some minor if I go this pig right now and it's like, why do you have I can't even fit in your pocket yeah yeah yeah.",2021-05-07_elijahting_jessicaryanwilcox_videostore_transcript.vtt
mainstreet033,184,00:25:53.460,00:25:54.540,Monique Lillard,Okay what's your.,2021-05-07_elijahting_jessicaryanwilcox_videostore_transcript.vtt
mainstreet033,185,00:25:55.620,00:25:58.950,Monique Lillard,Memories of the store just something funny something weird something.,2021-05-07_elijahting_jessicaryanwilcox_videostore_transcript.vtt
mainstreet033,186,00:25:59.970,00:26:09.570,Monique Lillard,"And memorable in any way, so they had like the very like inappropriate like comedy movies, they had all the adult movies, and I remember going to the comedy section.",2021-05-07_elijahting_jessicaryanwilcox_videostore_transcript.vtt
mainstreet033,187,00:26:10.260,00:26:14.100,Monique Lillard,And just looking around and then I wasn't supposed to and grabbing on a movie.,2021-05-07_elijahting_jessicaryanwilcox_videostore_transcript.vtt
mainstreet033,188,00:26:14.730,00:26:27.030,Monique Lillard,That at the time I probably shouldn't have brought out and like read about they have almost like the description on the back and I remember you came over and was like eli toby that good little reader like dad was like.,2021-05-07_elijahting_jessicaryanwilcox_videostore_transcript.vtt
mainstreet033,189,00:26:28.770,00:26:30.540,Monique Lillard,And then kind of took it from being put it back.,2021-05-07_elijahting_jessicaryanwilcox_videostore_transcript.vtt
mainstreet033,190,00:26:31.950,00:26:38.970,Monique Lillard,"Like I didn't even think twice about it, it was like i'm trying to remember the I think it was some sort of like cowboy movie.",2021-05-07_elijahting_jessicaryanwilcox_videostore_transcript.vtt
mainstreet033,191,00:26:40.530,00:26:47.280,Monique Lillard,i'm thinking of like the specific time of it was like because now it was pretty funny.,2021-05-07_elijahting_jessicaryanwilcox_videostore_transcript.vtt
mainstreet033,192,00:26:48.300,00:26:52.800,Monique Lillard,um I think that was one of the funniest times i've been late or actually.,2021-05-07_elijahting_jessicaryanwilcox_videostore_transcript.vtt
mainstreet033,193,00:26:54.270,00:27:02.160,Monique Lillard,"I think all me, we are only I think it was one time or a few times, we will make we're allowed to rent out like a children's movie since there's only like.",2021-05-07_elijahting_jessicaryanwilcox_videostore_transcript.vtt
mainstreet033,194,00:27:03.420,00:27:17.670,Monique Lillard,One of US coming so it'd be like me and you or maybe like you guess came or rose came and we'd argue for like 15 minutes just trying to pick out a movie that both of us wanted to watch.,2021-05-07_elijahting_jessicaryanwilcox_videostore_transcript.vtt
mainstreet033,195,00:27:19.140,00:27:31.020,Monique Lillard,"Neither, otherwise the same is really the test so stephanie i'd be like to get one line, sometimes we will be there to me, I guess, would be like okay mine and rose will be like.",2021-05-07_elijahting_jessicaryanwilcox_videostore_transcript.vtt
mainstreet033,196,00:27:34.170,00:27:34.830,Monique Lillard,One from.,2021-05-07_elijahting_jessicaryanwilcox_videostore_transcript.vtt
mainstreet033,197,00:27:37.350,00:27:46.920,Monique Lillard,"That one for no one frozen livers came out which receiver and it was on one more Ryan at that one yeah online car ride, we went to.",2021-05-07_elijahting_jessicaryanwilcox_videostore_transcript.vtt
mainstreet033,198,00:27:48.030,00:27:57.120,Monique Lillard,wasn't Montana know like missoula for hockey tournament Maybe it was a call we watched it like three times in one drives just like.,2021-05-07_elijahting_jessicaryanwilcox_videostore_transcript.vtt
mainstreet033,199,00:28:00.600,00:28:01.770,Monique Lillard,i'm not gonna lie that's.,2021-05-07_elijahting_jessicaryanwilcox_videostore_transcript.vtt
mainstreet033,200,00:28:04.320,00:28:07.950,Monique Lillard,Usually like two really good ones like she likes the good ones.,2021-05-07_elijahting_jessicaryanwilcox_videostore_transcript.vtt
mainstreet033,201,00:28:09.060,00:28:19.710,Monique Lillard,"and frozen riah that's a really good and to go wrong in the year 2021, which is when we're taking this is how 910 year.",2021-05-07_elijahting_jessicaryanwilcox_videostore_transcript.vtt
mainstreet033,202,00:28:22.170,00:28:26.970,Monique Lillard,High School and like four months now okay wow okay yeah.,2021-05-07_elijahting_jessicaryanwilcox_videostore_transcript.vtt
mainstreet033,203,00:28:28.350,00:28:31.050,Monique Lillard,It isn't good more memories stories.,2021-05-07_elijahting_jessicaryanwilcox_videostore_transcript.vtt
mainstreet033,204,00:28:33.150,00:28:41.820,Monique Lillard,"Oh, more memories your stories if that's that that's like my memory is always been scared of the SCI fi section yeah.",2021-05-07_elijahting_jessicaryanwilcox_videostore_transcript.vtt
mainstreet033,205,00:28:42.270,00:28:49.410,Monique Lillard,"There was some scary stuff in there Oh, I remember, I always asked her rent out at just because it's my initials allies retain the movie.",2021-05-07_elijahting_jessicaryanwilcox_videostore_transcript.vtt
mainstreet033,206,00:28:50.160,00:28:58.230,Monique Lillard,"Say was my favorite and i'd be like can we get this movie you guys always told me know because I honestly like it's a really good movie but, at the time I didn't even like it, that much.",2021-05-07_elijahting_jessicaryanwilcox_videostore_transcript.vtt
mainstreet033,207,00:28:58.980,00:29:11.160,Monique Lillard,"I liked it because it had my initial thought I was so special because you have the time or that like nobody has the same names, especially in the school, I was so small, so the kids and the name eli that's like the same special chillin.",2021-05-07_elijahting_jessicaryanwilcox_videostore_transcript.vtt
mainstreet033,208,00:29:13.230,00:29:13.920,Monique Lillard,um.,2021-05-07_elijahting_jessicaryanwilcox_videostore_transcript.vtt
mainstreet033,209,00:29:16.560,00:29:25.980,Monique Lillard,"yeah, but a lot of like the SCI fi shows really scared man like we're looking at the covers and covers yeah I remember when it first came out.",2021-05-07_elijahting_jessicaryanwilcox_videostore_transcript.vtt
mainstreet033,210,00:29:27.210,00:29:31.110,Monique Lillard,"I would not go up to the place and look through them, I will send.",2021-05-07_elijahting_jessicaryanwilcox_videostore_transcript.vtt
mainstreet033,211,00:29:32.940,00:29:37.920,Monique Lillard,"You over again, I was not happy with it i'm.",2021-05-07_elijahting_jessicaryanwilcox_videostore_transcript.vtt
mainstreet033,212,00:29:40.710,00:29:43.500,Monique Lillard,"Trying to think of anything else, my memories are either.",2021-05-07_elijahting_jessicaryanwilcox_videostore_transcript.vtt
mainstreet033,213,00:29:44.520,00:29:46.080,Monique Lillard,been negotiations and.,2021-05-07_elijahting_jessicaryanwilcox_videostore_transcript.vtt
mainstreet033,214,00:29:47.400,00:29:48.780,Monique Lillard,yeah it was fun.,2021-05-07_elijahting_jessicaryanwilcox_videostore_transcript.vtt
mainstreet033,215,00:29:50.580,00:29:51.120,,that's good.,2021-05-07_elijahting_jessicaryanwilcox_videostore_transcript.vtt
mainstreet033,216,00:29:52.140,00:29:58.890,Monique Lillard,What else right whatever I forgotten to ask you what else do you want to say what's the future know about this.,2021-05-07_elijahting_jessicaryanwilcox_videostore_transcript.vtt
mainstreet033,217,00:30:00.570,00:30:07.020,Monique Lillard,"I think at the moment I think it's a much more enjoyable experience, then going up to like a machine.",2021-05-07_elijahting_jessicaryanwilcox_videostore_transcript.vtt
mainstreet033,218,00:30:07.440,00:30:14.010,Monique Lillard,That you put and drape over your head so it's not shining light in your eyes and you're going to screen the of the tablet five times to get it to work.,2021-05-07_elijahting_jessicaryanwilcox_videostore_transcript.vtt
mainstreet033,219,00:30:14.730,00:30:25.920,Monique Lillard,"haha yes has many struggles with those things the redbox ones, especially going after this definitely not as fun, as we go into a store with my family and picking out some around town.",2021-05-07_elijahting_jessicaryanwilcox_videostore_transcript.vtt
mainstreet033,220,00:30:27.270,00:30:30.270,Monique Lillard,"arguing over sharing the drink, so we all got.",2021-05-07_elijahting_jessicaryanwilcox_videostore_transcript.vtt
mainstreet033,221,00:30:31.950,00:30:33.870,Monique Lillard,All the movies um.,2021-05-07_elijahting_jessicaryanwilcox_videostore_transcript.vtt
