objectid,transcript_line,start,end,speaker,text,txt_filename
mainstreet035,252,00:30:40.800,00:30:43.290,Courtney Berge,So I liked the little variations of steps and.,2021-07-02_courtneyberge_videostore_transcript.vtt
mainstreet035,253,00:30:44.430,00:30:45.150,Courtney Berge,It was nice.,2021-07-02_courtneyberge_videostore_transcript.vtt
mainstreet035,254,00:30:46.650,00:30:53.100,Monique Lillard,"To us, the customer over all these years, who was the most important person in the store.",2021-07-02_courtneyberge_videostore_transcript.vtt
mainstreet035,255,00:30:56.610,00:30:57.720,Courtney Berge,um.,2021-07-02_courtneyberge_videostore_transcript.vtt
mainstreet035,256,00:31:00.120,00:31:05.100,Courtney Berge,I don't know if they were in portland I know that there are certain people that I just.,2021-07-02_courtneyberge_videostore_transcript.vtt
mainstreet035,257,00:31:06.120,00:31:11.880,Courtney Berge,seemed to have worked there forever and I just like remember being there um.,2021-07-02_courtneyberge_videostore_transcript.vtt
mainstreet035,258,00:31:13.680,00:31:15.930,Courtney Berge,And I feel like part of that was like.,2021-07-02_courtneyberge_videostore_transcript.vtt
mainstreet035,259,00:31:20.130,00:31:32.700,Courtney Berge,"Part of I always thought the clerks were really cool but I don't know if that, in part because, like my brother, I think, was friends with some of them, and so, in my mind if someone is friends with my brother, they were cool.",2021-07-02_courtneyberge_videostore_transcript.vtt
mainstreet035,260,00:31:34.920,00:31:42.570,Courtney Berge,"um but, from my point of view, I guess, the most important people were people I was there with.",2021-07-02_courtneyberge_videostore_transcript.vtt
mainstreet035,261,00:31:43.740,00:31:50.910,Monique Lillard,that's a nice answer yeah did you often run into friends who you you didn't walk into the store with but people you knew.,2021-07-02_courtneyberge_videostore_transcript.vtt
mainstreet035,262,00:31:51.840,00:31:59.190,Courtney Berge,It often no I think if I saw someone there that I knew it was because we went there together yeah yeah.,2021-07-02_courtneyberge_videostore_transcript.vtt
mainstreet035,263,00:31:59.880,00:32:02.760,Monique Lillard,"So, how did you learn that the video store was closing for good.",2021-07-02_courtneyberge_videostore_transcript.vtt
mainstreet035,264,00:32:03.540,00:32:11.550,Courtney Berge,"I was there, the day before they shut the doors returning a video, and I remember the Clerk saying that they were closing and I didn't know.",2021-07-02_courtneyberge_videostore_transcript.vtt
mainstreet035,265,00:32:12.450,00:32:19.890,Courtney Berge,"At that time, I think I thought it was they were just closing because the governor had made the order for the shutdown, and so they were closing.",2021-07-02_courtneyberge_videostore_transcript.vtt
mainstreet035,266,00:32:20.520,00:32:30.090,Courtney Berge,"And then I was on Facebook, the next day and a message pops up that they were closing for good, and I was very sad because I had already planned what my next rental was going to be.",2021-07-02_courtneyberge_videostore_transcript.vtt
mainstreet035,267,00:32:31.410,00:32:37.380,Monique Lillard,"Okay, so you thought about the movies, that you had already planned.",2021-07-02_courtneyberge_videostore_transcript.vtt
mainstreet035,268,00:32:39.930,00:32:40.920,Monique Lillard,And felt sad.,2021-07-02_courtneyberge_videostore_transcript.vtt
mainstreet035,269,00:32:42.690,00:32:45.300,Monique Lillard,"How will you see those movies, have you seen them yet.",2021-07-02_courtneyberge_videostore_transcript.vtt
mainstreet035,270,00:32:45.330,00:33:01.290,Courtney Berge,"it's been a year I haven't I think that honestly that the movie that I was gonna rent the next time I went in I think I saw it, when I was on Boxing all of the movies, and special collections and.",2021-07-02_courtneyberge_videostore_transcript.vtt
mainstreet035,271,00:33:02.520,00:33:03.480,Courtney Berge,So.,2021-07-02_courtneyberge_videostore_transcript.vtt
mainstreet035,272,00:33:04.110,00:33:10.680,Courtney Berge,"um it might be here, I could be remembering correctly, because I went through i've gone through a lot of movies.",2021-07-02_courtneyberge_videostore_transcript.vtt
mainstreet035,273,00:33:12.570,00:33:18.270,Courtney Berge,But i'm my sneak it up to the reading room and watch it it's me.,2021-07-02_courtneyberge_videostore_transcript.vtt
mainstreet035,274,00:33:20.460,00:33:24.090,Monique Lillard,You know I think you know something that I don't know and I haven't heard from anybody.,2021-07-02_courtneyberge_videostore_transcript.vtt
mainstreet035,275,00:33:26.160,00:33:38.670,Monique Lillard,"we've been talking with a lot of people about what happened to the movies, and obviously the bulk of them were given Rebecca all of them, the movie inventory film title inventory was given to the kenworthy right.",2021-07-02_courtneyberge_videostore_transcript.vtt
mainstreet035,276,00:33:39.480,00:33:45.240,Monique Lillard,And then the can you describe how the University of Idaho got involved.,2021-07-02_courtneyberge_videostore_transcript.vtt
mainstreet035,277,00:33:46.680,00:33:46.860,Monique Lillard,and,2021-07-02_courtneyberge_videostore_transcript.vtt
mainstreet035,278,00:33:48.180,00:33:56.640,Courtney Berge,"i'm so we got involved, because the camera he was starting their movie sale.",2021-07-02_courtneyberge_videostore_transcript.vtt
mainstreet035,279,00:33:57.690,00:34:05.040,Courtney Berge,"They were offloading a lot of the inventory and they were opening it up to the Community, and I think.",2021-07-02_courtneyberge_videostore_transcript.vtt
mainstreet035,280,00:34:06.480,00:34:17.880,Courtney Berge,If I remember correctly i'm the dean of the library sent out to people in the library of the some of the lists or whatever that we're going around.,2021-07-02_courtneyberge_videostore_transcript.vtt
mainstreet035,281,00:34:18.600,00:34:39.390,Courtney Berge,"To see if we could get some extra titles that may be like we had a low section in our circulation or like important films that we didn't have and he sent it out to like all of us, because he was like i'm not a movie buff but I know some of the staff is um and around that time.",2021-07-02_courtneyberge_videostore_transcript.vtt
mainstreet035,282,00:34:41.040,00:34:46.890,Courtney Berge,Special collections was thinking well the Howard Hughes video is like.,2021-07-02_courtneyberge_videostore_transcript.vtt
mainstreet035,283,00:34:48.630,00:35:07.440,Courtney Berge,"kind of a staple of Moscow and we collect the papers and stuff of businesses and people of the area and things that are important, and then there was also the added aspect of video stores are dying it's not just a closed business it's kind of a closed form of business.",2021-07-02_courtneyberge_videostore_transcript.vtt
mainstreet035,284,00:35:08.910,00:35:17.220,Courtney Berge,And so we started talks with our Dean about seeing if we could acquire whatever the kenworthy didn't end up selling.,2021-07-02_courtneyberge_videostore_transcript.vtt
mainstreet035,285,00:35:17.940,00:35:30.780,Courtney Berge,"With the hopes of kind of preserving that catalog as best we can, and like I think we also got like their point of sale computer that will have to figure out what we're going to do with and things like that.",2021-07-02_courtneyberge_videostore_transcript.vtt
mainstreet035,286,00:35:33.120,00:35:55.890,Courtney Berge,"I think that's on the digital end and not really my my purview, and so I I don't know the negotiations or whatever with the kenworthy in the library, but we ended up acquiring approximately 14,000 DVDs and a few hundred vhs is.",2021-07-02_courtneyberge_videostore_transcript.vtt
mainstreet035,287,00:35:57.540,00:35:59.550,Courtney Berge,And i'm.,2021-07-02_courtneyberge_videostore_transcript.vtt
mainstreet035,288,00:36:01.620,00:36:14.730,Courtney Berge,"I I still haven't finished going through all of them, they sent us like an inventory and so when it came in my main job was to figure out what we got from like their big list of inventories and what.",2021-07-02_courtneyberge_videostore_transcript.vtt
mainstreet035,289,00:36:16.290,00:36:31.170,Courtney Berge,"We didn't kind of get um but even that was not complete i've done most of it, but not the bit that wasn't on the list, so I still have to inventory, the films and and identifying what we had duplicates of as well because.",2021-07-02_courtneyberge_videostore_transcript.vtt
mainstreet035,290,00:36:32.370,00:36:36.690,Courtney Berge,There were a lot of duplicates because you know they had multiple copies to Landau.,2021-07-02_courtneyberge_videostore_transcript.vtt
mainstreet035,291,00:36:40.530,00:36:46.650,Courtney Berge,"And that, and then we decided to do the this oral History project to kind of.",2021-07-02_courtneyberge_videostore_transcript.vtt
mainstreet035,292,00:36:48.330,00:36:54.540,Courtney Berge,encapsulate the importance of like what a video store is to a Community and also.,2021-07-02_courtneyberge_videostore_transcript.vtt
mainstreet035,293,00:36:55.620,00:37:06.060,Courtney Berge,capture like the memories of of people who had it because it was such an important part of the area and I advocated that we got it because I thought it would be nice that's.,2021-07-02_courtneyberge_videostore_transcript.vtt
mainstreet035,294,00:37:06.270,00:37:13.980,Monique Lillard,"Great I think that's fascinating you know I did not realize that the university had as many as 14,000.",2021-07-02_courtneyberge_videostore_transcript.vtt
mainstreet035,295,00:37:14.340,00:37:17.250,Courtney Berge,yeah um they're not all.,2021-07-02_courtneyberge_videostore_transcript.vtt
mainstreet035,296,00:37:18.360,00:37:39.660,Courtney Berge,they're not like the admittedly they're not like the great hits or whatever the that it's a lot of the popular stuff a lot of partial TV like because they broke out the discs so you could rent like a disc or two um so it's impartial TV series and some British TV but um.,2021-07-02_courtneyberge_videostore_transcript.vtt
mainstreet035,297,00:37:41.610,00:37:44.880,Courtney Berge,There were some sections we didn't get any anything from.,2021-07-02_courtneyberge_videostore_transcript.vtt
mainstreet035,298,00:37:45.720,00:37:52.260,Monique Lillard,you've actually given me hope because there were certain titles that I wished I bought from the kenworthy and.,2021-07-02_courtneyberge_videostore_transcript.vtt
mainstreet035,299,00:37:53.160,00:38:03.030,Monique Lillard,"i've got just I don't know if I was depressed or just distracted you know it's all during this pandemic and I somehow missed several chunks of the sales, but there are actually some obscure TV shows.",2021-07-02_courtneyberge_videostore_transcript.vtt
mainstreet035,300,00:38:03.720,00:38:13.980,Monique Lillard,"Which so eventually, let me i'm sorry that I started and stuff eventually is the library, going to be renting these out or are you going to hold it like history.",2021-07-02_courtneyberge_videostore_transcript.vtt
mainstreet035,301,00:38:14.790,00:38:25.950,Courtney Berge,And that's something that I think it's still kind of in limbo cuz because we it's in special collections it's an archive there's like a certain responsibility to like.,2021-07-02_courtneyberge_videostore_transcript.vtt
mainstreet035,302,00:38:26.490,00:38:37.560,Courtney Berge,"preserve and make accessible and like them, but also make accessible, and so we haven't figured out how to balance that and they're also stored in special collections.",2021-07-02_courtneyberge_videostore_transcript.vtt
mainstreet035,303,00:38:37.950,00:38:51.150,Courtney Berge,Which is a secured location that not everyone in the library can get to so it's not So there are a lot of logistical things that we're still trying to figure out at this point of how to make them accessible.,2021-07-02_courtneyberge_videostore_transcript.vtt
mainstreet035,304,00:38:51.930,00:39:09.240,Courtney Berge,"we've talked about doing some sort of like podcast or having like movie watching parties in the future, like at the library, because then people could at least come see a movie but it's not getting rented out and worn worn down.",2021-07-02_courtneyberge_videostore_transcript.vtt
mainstreet035,305,00:39:10.680,00:39:15.120,Courtney Berge,"So if that's still in in question at this point, but.",2021-07-02_courtneyberge_videostore_transcript.vtt
mainstreet035,306,00:39:16.230,00:39:24.600,Courtney Berge,"we're going to try to make them as accessible as we possibly can to the Community, we just haven't figured out how to do that yet right gotcha.",2021-07-02_courtneyberge_videostore_transcript.vtt
mainstreet035,307,00:39:24.630,00:39:35.550,Monique Lillard,"that's very interesting and then there were just lots of things and, frankly, it was the lesser titles that I thought in a way, where the most important to preserve I mean.",2021-07-02_courtneyberge_videostore_transcript.vtt
mainstreet035,308,00:39:36.210,00:39:46.320,Monique Lillard,"Gone with the wind is always going to be available yeah let's say they pulled it off because it was politically incorrect for about a day or two, and then they put it back that's not going to vanish but.",2021-07-02_courtneyberge_videostore_transcript.vtt
mainstreet035,309,00:39:46.980,00:39:55.020,Monique Lillard,"Alright, so the TV show i'm thinking it was called American dreams, it was it, I think it went two or three seasons and then it just fizzled out.",2021-07-02_courtneyberge_videostore_transcript.vtt
mainstreet035,310,00:39:55.590,00:39:55.890,Courtney Berge,and,2021-07-02_courtneyberge_videostore_transcript.vtt
mainstreet035,311,00:39:56.250,00:40:04.080,Monique Lillard,"For some reason I loved it and then it turned out friends of mines were actually the producers and directors and everything i'm from southern California, you know and.",2021-07-02_courtneyberge_videostore_transcript.vtt
mainstreet035,312,00:40:04.650,00:40:17.100,Monique Lillard,I thought that's a good example of a TV show this never going to be super famous right maybe one of the actors will become somebody really important but it's been 1015 years now probably not but.,2021-07-02_courtneyberge_videostore_transcript.vtt
mainstreet035,313,00:40:17.490,00:40:29.280,Monique Lillard,It tells you something about what movies were being made and what the pressures were so to me that becomes almost a historic and historical document that needs to be preserved because it's not going to be commercially great.,2021-07-02_courtneyberge_videostore_transcript.vtt
mainstreet035,314,00:40:29.340,00:40:30.840,Monique Lillard,yeah yeah.,2021-07-02_courtneyberge_videostore_transcript.vtt
mainstreet035,315,00:40:31.560,00:40:33.150,Courtney Berge,I was ahead.,2021-07-02_courtneyberge_videostore_transcript.vtt
mainstreet035,316,00:40:33.360,00:40:34.200,Monique Lillard,"No, you go ahead.",2021-07-02_courtneyberge_videostore_transcript.vtt
mainstreet035,317,00:40:34.470,00:40:40.950,Courtney Berge,I was just gonna say when they did the sale I didn't buy any from the list because I tried to open.,2021-07-02_courtneyberge_videostore_transcript.vtt
mainstreet035,318,00:40:42.060,00:40:56.070,Courtney Berge,"I forgot when they were releasing the lists like a lot, and then the one time I emailed them to ask for a list to see what they had, and it was just so massive that I was like.",2021-07-02_courtneyberge_videostore_transcript.vtt
mainstreet035,319,00:40:56.940,00:41:09.090,Courtney Berge,"I don't know what I want and I don't have the time to like sift through this list, but a few of my friends got several titles.",2021-07-02_courtneyberge_videostore_transcript.vtt
mainstreet035,320,00:41:10.200,00:41:27.600,Courtney Berge,"From from the kenworthy um and they they've been working on watching all of them, but one day we had a a watch party, because we were going to launch one of the movies, I got because I got I got five I think five titles from one of the sidewalk sales that they did on a Saturday morning.",2021-07-02_courtneyberge_videostore_transcript.vtt
mainstreet035,321,00:41:28.950,00:41:37.320,Courtney Berge,And we're going to watch one of those but we didn't we ended up watching one that my friend had got called werewolf on wheels.,2021-07-02_courtneyberge_videostore_transcript.vtt
mainstreet035,322,00:41:38.430,00:41:48.450,Courtney Berge,"which was like this 1970s 60s kind of free writer, whatever that movie was, but it was.",2021-07-02_courtneyberge_videostore_transcript.vtt
mainstreet035,323,00:41:50.460,00:42:11.850,Courtney Berge,"It wasn't movie um it was an odd movie there was more of a satanic cult than werewolves in it, it was very bizarre um but we had a good time watching it and then the other one that we had watched that night was called vampires with an a blood brothers and blood.",2021-07-02_courtneyberge_videostore_transcript.vtt
mainstreet035,324,00:42:15.090,00:42:23.010,Courtney Berge,"And that was like a home, it seemed like a home movie that someone was like I want to make a vampire movie.",2021-07-02_courtneyberge_videostore_transcript.vtt
mainstreet035,325,00:42:24.480,00:42:29.040,Courtney Berge,And I don't know if anyone else has ever seen vampire has brought this in blood.,2021-07-02_courtneyberge_videostore_transcript.vtt
mainstreet035,326,00:42:30.060,00:42:32.280,Courtney Berge,I wouldn't necessarily recommend it.,2021-07-02_courtneyberge_videostore_transcript.vtt
mainstreet035,327,00:42:34.290,00:42:41.340,Courtney Berge,But i'm glad that I saw it i'm glad I know it exists but someone spent their time making it.,2021-07-02_courtneyberge_videostore_transcript.vtt
mainstreet035,328,00:42:42.330,00:42:48.360,Monique Lillard,It was exactly what i'm talking about you know it's it's it's part of the whole thing.,2021-07-02_courtneyberge_videostore_transcript.vtt
mainstreet035,329,00:42:48.600,00:42:49.980,Courtney Berge,yeah yeah.,2021-07-02_courtneyberge_videostore_transcript.vtt
mainstreet035,330,00:42:50.040,00:43:05.550,Courtney Berge,"I think bad cinema is only bad when people are snobs about it in many ways, like someone put effort and money into a passion project and i'm not going to begrudge them that one bit.",2021-07-02_courtneyberge_videostore_transcript.vtt
mainstreet035,331,00:43:06.990,00:43:16.020,Monique Lillard,"or every now and then somebody pretty old becomes suddenly famous and then we, we want to watch all the schlocky stuff they made.",2021-07-02_courtneyberge_videostore_transcript.vtt
mainstreet035,332,00:43:16.500,00:43:27.990,Monique Lillard,"yeah over their lifetime yeah yeah I fascinating now, you said something that I just want to pick up on it, you said, the kenworthy put out these lists and you're probably looking at them online on a screen right.",2021-07-02_courtneyberge_videostore_transcript.vtt
mainstreet035,333,00:43:28.020,00:43:30.720,Courtney Berge,yeah I have them email them to me yeah them email them.,2021-07-02_courtneyberge_videostore_transcript.vtt
mainstreet035,334,00:43:32.280,00:43:46.200,Monique Lillard,"And you said oh I can't go through it, can you talk about the difference between looking at a list of things and being in a room and seeing a bunch of boxes and touching them or pointing your finger or.",2021-07-02_courtneyberge_videostore_transcript.vtt
mainstreet035,335,00:43:46.890,00:43:55.350,Monique Lillard,"However, you do it friend of mine used to collect cherry picking I do it with books and libraries, too, I love open stacks not close to X, I want to go in there and just sort of see you know.",2021-07-02_courtneyberge_videostore_transcript.vtt
mainstreet035,336,00:43:55.860,00:44:07.770,Courtney Berge,yeah um so with the list all you have is a bunch of Titles that unless you're gonna research what the title is you have no idea.,2021-07-02_courtneyberge_videostore_transcript.vtt
mainstreet035,337,00:44:08.550,00:44:19.860,Courtney Berge,"What the movie is one of my friends got the Mummy and she was like I got the money but it's not the Mummy are thinking of, or the other Mummy you're thinking of, or the other Mummy are thinking of.",2021-07-02_courtneyberge_videostore_transcript.vtt
mainstreet035,338,00:44:22.560,00:44:31.860,Courtney Berge,And so that's also an issue with lists is you know what title but multiple films have the same title and with Howard Hughes.,2021-07-02_courtneyberge_videostore_transcript.vtt
mainstreet035,339,00:44:33.030,00:44:46.140,Courtney Berge,You never know you didn't know if it was going to be the well known title with the well known movie with that title or the D grade movie from cult classics with that title.,2021-07-02_courtneyberge_videostore_transcript.vtt
mainstreet035,340,00:44:48.030,00:44:56.070,Courtney Berge,"So I just like I didn't know because i'm not a movie buff I enjoy movies, I rarely know directors, I rarely know.",2021-07-02_courtneyberge_videostore_transcript.vtt
mainstreet035,341,00:44:56.850,00:45:14.280,Courtney Berge,"The Louvre of people I always would go and I look at it, the box if it caught my interest i'd be like I look at the title and i'd be like and then i'd read the back and i'd be like huh looks fun and I would either pick it or not.",2021-07-02_courtneyberge_videostore_transcript.vtt
mainstreet035,342,00:45:15.960,00:45:17.370,Courtney Berge,can't do that with the list.,2021-07-02_courtneyberge_videostore_transcript.vtt
mainstreet035,343,00:45:18.780,00:45:30.870,Courtney Berge,And I think like it's like most people love movie posters and like DVD cases are just like smaller versions of the poster they're intended to get you interested in the movie like that's the whole point.,2021-07-02_courtneyberge_videostore_transcript.vtt
mainstreet035,344,00:45:33.660,00:45:48.570,Courtney Berge,"Their marketing and you don't get that when you're just trying to read a list, and if you don't know exactly what you're looking for the list isn't helpful I wasn't gonna just pick out five random titles, with no context so.",2021-07-02_courtneyberge_videostore_transcript.vtt
mainstreet035,345,00:45:50.160,00:45:57.450,Monique Lillard,Even the lettering and the coloring of the box is sending tons of messages to us yeah.,2021-07-02_courtneyberge_videostore_transcript.vtt
mainstreet035,346,00:45:57.900,00:46:03.000,Courtney Berge,"And it tells you the year that it was made, which gives you context of like the type of film it's.",2021-07-02_courtneyberge_videostore_transcript.vtt
mainstreet035,347,00:46:03.000,00:46:04.320,Courtney Berge,likely to be.,2021-07-02_courtneyberge_videostore_transcript.vtt
mainstreet035,348,00:46:05.970,00:46:13.830,Courtney Berge,tells you the actors who are in it which helps a lot if you're one of those people who's like I like this actor I don't.,2021-07-02_courtneyberge_videostore_transcript.vtt
mainstreet035,349,00:46:13.890,00:46:15.150,Monique Lillard,go back to that hall of fame.,2021-07-02_courtneyberge_videostore_transcript.vtt
mainstreet035,350,00:46:15.240,00:46:16.620,Monique Lillard,yeah wall of fame yeah.,2021-07-02_courtneyberge_videostore_transcript.vtt
mainstreet035,351,00:46:16.860,00:46:22.590,Courtney Berge,"I mean, I still do it, I go to actors imdb page is all the time and i'm like what else have you been in.",2021-07-02_courtneyberge_videostore_transcript.vtt
mainstreet035,352,00:46:23.700,00:46:32.220,Courtney Berge,"or i'll check it to see if, who, I think, is in a movie is actually in the movie because i'm not good at identifying or remembering names.",2021-07-02_courtneyberge_videostore_transcript.vtt
mainstreet035,353,00:46:32.970,00:46:48.360,Courtney Berge,"My husband's worst he'll be like he's that guy from that movie and i'm like no he's not he's like he is he is i'm like No, that is not George clooney and he's like yes, when I pull up the imdb page and i'm like George clooney is not in this movie.",2021-07-02_courtneyberge_videostore_transcript.vtt
mainstreet035,354,00:46:51.270,00:46:56.910,Monique Lillard,"I do it with Wikipedia rather than imdb I don't know why, but I sometimes use imdb yeah.",2021-07-02_courtneyberge_videostore_transcript.vtt
mainstreet035,355,00:46:57.270,00:47:00.690,Courtney Berge,I sometimes use Wikipedia but imdb just has the full list.,2021-07-02_courtneyberge_videostore_transcript.vtt
mainstreet035,356,00:47:01.050,00:47:09.810,Monique Lillard,"that's true that's true yeah yeah now How did the University of Idaho library then pick the title, so that they just take the leftovers.",2021-07-02_courtneyberge_videostore_transcript.vtt
mainstreet035,357,00:47:09.840,00:47:13.440,Monique Lillard,"are what we just made you tried to describe it, but if you could just sort of explain it.",2021-07-02_courtneyberge_videostore_transcript.vtt
mainstreet035,358,00:47:13.470,00:47:20.190,Courtney Berge,We had what was left with the DVDs that were left after the kenworthy it was done okay.,2021-07-02_courtneyberge_videostore_transcript.vtt
mainstreet035,359,00:47:20.820,00:47:21.270,,and,2021-07-02_courtneyberge_videostore_transcript.vtt
mainstreet035,360,00:47:22.620,00:47:25.350,Monique Lillard,Did you say that the library got some duplicates.,2021-07-02_courtneyberge_videostore_transcript.vtt
mainstreet035,361,00:47:26.400,00:47:48.480,Courtney Berge,"So, within the yeah there were duplicates within the thing mostly I mean not mostly it's hard to say, mostly um a lot of them were like the blockbuster like the new release genre they weren't new anymore, but like titles, that you would have heard like heard of before.",2021-07-02_courtneyberge_videostore_transcript.vtt
mainstreet035,362,00:47:48.900,00:47:51.060,Monique Lillard,The ones that they thought they should buy multiple copies.,2021-07-02_courtneyberge_videostore_transcript.vtt
mainstreet035,363,00:47:51.060,00:47:51.780,Courtney Berge,yeah right.,2021-07-02_courtneyberge_videostore_transcript.vtt
