objectid,transcript_line,start,end,speaker,text,txt_filename
mainstreet005,151,00:12:54.990,00:12:59.970,Beau Newsome,"Oh really Okay, so you mentioned what what kind of class how many like film classes, did you.",2021-05-19_benjames_videostore_transcript.vtt
mainstreet005,152,00:13:01.290,00:13:01.650,Beau Newsome,Like.,2021-05-19_benjames_videostore_transcript.vtt
mainstreet005,153,00:13:01.920,00:13:02.430,Beau Newsome,about it.,2021-05-19_benjames_videostore_transcript.vtt
mainstreet005,154,00:13:02.460,00:13:05.310,Ben James,"You know so i've been there, what nearly.",2021-05-19_benjames_videostore_transcript.vtt
mainstreet005,155,00:13:06.420,00:13:16.380,Ben James,"At least 10 years, I suppose, and so my classes that i've taught have changed over time, but the main ones that i've taught i've been I did.",2021-05-19_benjames_videostore_transcript.vtt
mainstreet005,156,00:13:17.760,00:13:24.990,Ben James,"A history of American horror cinema, which is pretty great told that the regular for quite a few years.",2021-05-19_benjames_videostore_transcript.vtt
mainstreet005,157,00:13:26.940,00:13:36.300,Ben James,"And then, a couple of film history classes just much broader film history classes about you know concerning what you might say, world cinema right so.",2021-05-19_benjames_videostore_transcript.vtt
mainstreet005,158,00:13:36.840,00:13:54.270,Ben James,"Focusing on different film movements throughout the throughout the 20th and 21st century, so there was like a history of cinema, part one, which is from like the 1890s to the Second World War, and then, part two, which is a whole of the Semester was like 1945 to the present day.",2021-05-19_benjames_videostore_transcript.vtt
mainstreet005,159,00:13:54.930,00:14:09.990,Ben James,"And that's probably my that's the the film history class that i've enjoyed the most probably because it, you know you start with Italian neorealist cinema and then you make your way, all the way through like you know everything from like bollywood's the French new wave to.",2021-05-19_benjames_videostore_transcript.vtt
mainstreet005,160,00:14:11.040,00:14:18.090,Ben James,"You know continue we watched them like this semester we watched bong joon ho's parasites, at the end of the Semester.",2021-05-19_benjames_videostore_transcript.vtt
mainstreet005,161,00:14:19.200,00:14:19.830,Ben James,Every film that.,2021-05-19_benjames_videostore_transcript.vtt
mainstreet005,162,00:14:20.580,00:14:20.760,Ben James,You.,2021-05-19_benjames_videostore_transcript.vtt
mainstreet005,163,00:14:21.240,00:14:21.930,Beau Newsome,know many movies.,2021-05-19_benjames_videostore_transcript.vtt
mainstreet005,164,00:14:21.960,00:14:24.810,Beau Newsome,"per class, I mean there's a very or is it.",2021-05-19_benjames_videostore_transcript.vtt
mainstreet005,165,00:14:25.140,00:14:25.470,Ben James,yeah.,2021-05-19_benjames_videostore_transcript.vtt
mainstreet005,166,00:14:25.770,00:14:26.910,Beau Newsome,What watch a lot of them are.,2021-05-19_benjames_videostore_transcript.vtt
mainstreet005,167,00:14:27.540,00:14:37.350,Ben James,"You watch we watch a lot of them, we have one film movement or film Culture per week and then there's so there's one assign film that you must watch every week.",2021-05-19_benjames_videostore_transcript.vtt
mainstreet005,168,00:14:38.790,00:14:48.390,Ben James,"So that's 16 movies, and then or probably less than that because there are a couple of breaks in there, but let's say 12 movies, and then there's.",2021-05-19_benjames_videostore_transcript.vtt
mainstreet005,169,00:14:49.800,00:15:00.900,Ben James,"A couple of different like analytical exercises that your essays and things that you have to do so, you have to watch, at least at least one or two movies, for those as well.",2021-05-19_benjames_videostore_transcript.vtt
mainstreet005,170,00:15:01.770,00:15:19.350,Ben James,"So yeah they get a good a good dose of yeah of movie making them this like the intro to the film major which we just got up and running recently and that's cool actually be stobo watching lots of more episodic shows, rather than movies.",2021-05-19_benjames_videostore_transcript.vtt
mainstreet005,171,00:15:19.740,00:15:19.950,Beau Newsome,Oh.,2021-05-19_benjames_videostore_transcript.vtt
mainstreet005,172,00:15:20.010,00:15:34.260,Ben James,"And then going using that as like a core tech so, for example, last time we did it we did them dear white people, and so they just watch an episode of dear white people every week and then we week by week you just focus on a different like a static.",2021-05-19_benjames_videostore_transcript.vtt
mainstreet005,173,00:15:35.280,00:15:41.790,Ben James,Elements say be like oh this week we're going to talk about some cinematography next week we're going to talk about acting like this week we're going to talk about.,2021-05-19_benjames_videostore_transcript.vtt
mainstreet005,174,00:15:42.390,00:15:50.100,Ben James,"You know editing stuff like that, so that was that's really cool I like that that's an interesting that's an interesting course good.",2021-05-19_benjames_videostore_transcript.vtt
mainstreet005,175,00:15:50.700,00:15:54.180,Beau Newsome,Speaking of dear white people whose based on the movie first.,2021-05-19_benjames_videostore_transcript.vtt
mainstreet005,176,00:15:54.180,00:15:55.560,Ben James,Correct that's right yeah.,2021-05-19_benjames_videostore_transcript.vtt
mainstreet005,177,00:15:55.830,00:15:57.180,Beau Newsome,Did you ever watch the movie.,2021-05-19_benjames_videostore_transcript.vtt
mainstreet005,178,00:15:57.510,00:16:01.110,Ben James,I watched the movie and I was like this is pretty good.,2021-05-19_benjames_videostore_transcript.vtt
mainstreet005,179,00:16:01.140,00:16:04.950,Ben James,yeah I enjoyed the movie but it didn't like.,2021-05-19_benjames_videostore_transcript.vtt
mainstreet005,180,00:16:05.250,00:16:24.900,Ben James,"I think I was expecting a bit much of it, and it was like I was like how this all right, but the show I think it's actually really, really something is the show, because the issues so so big so much scope to you know let's address race and contemporary.",2021-05-19_benjames_videostore_transcript.vtt
mainstreet005,181,00:16:26.040,00:16:39.150,Ben James,"Like okay there's a huge amount to kind of unpack there and it's and it's just, obviously, as you know, is like told through the lens of like a bunch of college students right it's an Ivy league college fantasy college.",2021-05-19_benjames_videostore_transcript.vtt
mainstreet005,182,00:16:40.590,00:16:45.330,Ben James,"And, and I think, because there are so many characters and so many more points of view.",2021-05-19_benjames_videostore_transcript.vtt
mainstreet005,183,00:16:45.480,00:16:48.480,Ben James,"And so much more time available to it, I think it's a lot more.",2021-05-19_benjames_videostore_transcript.vtt
mainstreet005,184,00:16:48.600,00:16:52.830,Beau Newsome,stretch it out a little bit more yeah there's there's so much to be can get into.,2021-05-19_benjames_videostore_transcript.vtt
mainstreet005,185,00:16:52.980,00:16:53.190,Ben James,But.,2021-05-19_benjames_videostore_transcript.vtt
mainstreet005,186,00:16:53.310,00:16:59.490,Beau Newsome,"I do, because a lot of if I remember right, it was just like different clicks on this college campus and.",2021-05-19_benjames_videostore_transcript.vtt
mainstreet005,187,00:16:59.640,00:17:00.510,Ben James,yeah that's right.,2021-05-19_benjames_videostore_transcript.vtt
mainstreet005,188,00:17:00.540,00:17:02.610,Beau Newsome,yeah but he's on perspectives and stuff.,2021-05-19_benjames_videostore_transcript.vtt
mainstreet005,189,00:17:02.610,00:17:05.640,Ben James,Like that's right and there's so much detail going into.,2021-05-19_benjames_videostore_transcript.vtt
mainstreet005,190,00:17:05.670,00:17:20.700,Ben James,"You start analyzing the show you realize how much detail is going into all of these different performances and how each of the characters has been molded and each one of them has like this backstory and storyline i'm like Okay, this is, this is a, this is a great show.",2021-05-19_benjames_videostore_transcript.vtt
mainstreet005,191,00:17:20.730,00:17:22.920,Ben James,it's really it's very small very good yeah.,2021-05-19_benjames_videostore_transcript.vtt
mainstreet005,192,00:17:23.040,00:17:24.420,Beau Newsome,But I love it yeah i'd love to watch.,2021-05-19_benjames_videostore_transcript.vtt
mainstreet005,193,00:17:24.420,00:17:28.020,Beau Newsome,It Do you know what format it's on these days so.,2021-05-19_benjames_videostore_transcript.vtt
mainstreet005,194,00:17:29.040,00:17:38.550,Ben James,"um I think we just I think it was from netflix when we when we streamed it for the class, I think it was like you gotta get netflix for the Semester guys that like yeah that's a textbook.",2021-05-19_benjames_videostore_transcript.vtt
mainstreet005,195,00:17:39.180,00:17:40.620,Beau Newsome,Right yeah that's fine yeah.,2021-05-19_benjames_videostore_transcript.vtt
mainstreet005,196,00:17:40.680,00:17:41.700,,pay for the textbook.,2021-05-19_benjames_videostore_transcript.vtt
mainstreet005,197,00:17:42.870,00:17:48.780,Beau Newsome,"So, like you mentioned streaming versus like I guess a local video store did.",2021-05-19_benjames_videostore_transcript.vtt
mainstreet005,198,00:17:50.250,00:17:55.140,Beau Newsome,The streaming help out quite a bit or was it still nice to utilize both or.,2021-05-19_benjames_videostore_transcript.vtt
mainstreet005,199,00:17:58.530,00:18:09.420,Ben James,"I love those me, I think, because I, I guess, because I grew up going to video stores and things like that i'll always love the idea that experience, I think.",2021-05-19_benjames_videostore_transcript.vtt
mainstreet005,200,00:18:13.170,00:18:22.170,Ben James,You know streaming has been useful for sure the University has this great pretty great platform called canopy so the K canopy.,2021-05-19_benjames_videostore_transcript.vtt
mainstreet005,201,00:18:22.950,00:18:35.790,Ben James,"That you might have come across and it hosts a lot of kind of streamer will content, a lot of kind of criterion or criterion adjacent titles and a lot of.",2021-05-19_benjames_videostore_transcript.vtt
mainstreet005,202,00:18:36.780,00:18:53.400,Ben James,"lot of non American cinema, which is, which is good for me for my classes so so that's been pretty useful just teaching and teaching his history of film like around the world there's a lot of things that are on that he can get into.",2021-05-19_benjames_videostore_transcript.vtt
mainstreet005,203,00:18:54.720,00:18:59.010,Ben James,So yeah that that's been that's been pretty handy there's a you know there's like.,2021-05-19_benjames_videostore_transcript.vtt
mainstreet005,204,00:19:00.300,00:19:16.380,Ben James,"there's no Bollywood on it actually that's one one blind spot I don't know why it has, but it has no there's no Indian national cinema on that really at all, but there's like nollywood movies, like Nigerian Nigerian movies.",2021-05-19_benjames_videostore_transcript.vtt
mainstreet005,205,00:19:18.060,00:19:20.940,Ben James,which are some of which I totally nuts.,2021-05-19_benjames_videostore_transcript.vtt
mainstreet005,206,00:19:22.620,00:19:23.640,Ben James,But I love.,2021-05-19_benjames_videostore_transcript.vtt
mainstreet005,207,00:19:24.780,00:19:37.170,Ben James,"yeah you know there's there's lots and there's lots of really like pretty RT cool kind of non American cinema in there as well, and then lifted documentaries and stuff so yeah canopy has been brilliant.",2021-05-19_benjames_videostore_transcript.vtt
mainstreet005,208,00:19:37.680,00:19:43.650,Beau Newsome,"Okay yeah speaking of blind spot I I don't think we had any Bollywood movies in the video store, if I can.",2021-05-19_benjames_videostore_transcript.vtt
mainstreet005,209,00:19:43.650,00:19:44.940,Ben James,"Remember, I said I.",2021-05-19_benjames_videostore_transcript.vtt
mainstreet005,210,00:19:45.450,00:19:47.970,Beau Newsome,Could temporary ones we had one called guru.,2021-05-19_benjames_videostore_transcript.vtt
mainstreet005,211,00:19:49.500,00:19:49.860,Ben James,Okay.,2021-05-19_benjames_videostore_transcript.vtt
mainstreet005,212,00:19:50.520,00:19:54.840,Beau Newsome,which was they were watching it in the movie called ghost world or no.,2021-05-19_benjames_videostore_transcript.vtt
mainstreet005,213,00:19:55.110,00:19:55.590,Ben James,Oh yeah.,2021-05-19_benjames_videostore_transcript.vtt
mainstreet005,214,00:19:55.860,00:19:57.720,Beau Newsome,"Was it ghost world, I think it was go swimming.",2021-05-19_benjames_videostore_transcript.vtt
mainstreet005,215,00:19:57.990,00:19:59.340,Ben James,"Yes, well, I don't know.",2021-05-19_benjames_videostore_transcript.vtt
mainstreet005,216,00:19:59.430,00:20:00.960,Beau Newsome,What scarlett johansson it's.,2021-05-19_benjames_videostore_transcript.vtt
mainstreet005,217,00:20:01.350,00:20:04.230,Beau Newsome,It was an indie movie yeah and they're watching unum.,2021-05-19_benjames_videostore_transcript.vtt
mainstreet005,218,00:20:04.890,00:20:05.940,Beau Newsome,And then so i'm.,2021-05-19_benjames_videostore_transcript.vtt
mainstreet005,219,00:20:06.180,00:20:09.480,Beau Newsome,Our one of our employees Ben hardcastle ordered and for the store and.,2021-05-19_benjames_videostore_transcript.vtt
mainstreet005,220,00:20:10.260,00:20:11.340,Beau Newsome,I think that was our one.,2021-05-19_benjames_videostore_transcript.vtt
mainstreet005,221,00:20:11.910,00:20:14.100,Beau Newsome,One Bollywood movie we had.,2021-05-19_benjames_videostore_transcript.vtt
mainstreet005,222,00:20:14.880,00:20:15.060,Ben James,But.,2021-05-19_benjames_videostore_transcript.vtt
mainstreet005,223,00:20:15.570,00:20:18.000,Beau Newsome,It was bizarre and it was great the music was great.,2021-05-19_benjames_videostore_transcript.vtt
mainstreet005,224,00:20:19.080,00:20:23.850,Ben James,cool that's fascinating like ghost world is like bollywood's entry drug.,2021-05-19_benjames_videostore_transcript.vtt
mainstreet005,225,00:20:24.060,00:20:25.410,Beau Newsome,that's right yeah that's.,2021-05-19_benjames_videostore_transcript.vtt
mainstreet005,226,00:20:26.820,00:20:28.080,Beau Newsome,How we found out about it.,2021-05-19_benjames_videostore_transcript.vtt
mainstreet005,227,00:20:29.130,00:20:29.880,Ben James,that's critical.,2021-05-19_benjames_videostore_transcript.vtt
mainstreet005,228,00:20:30.270,00:20:31.470,Ben James,You mentioned yeah I mean there's a.,2021-05-19_benjames_videostore_transcript.vtt
mainstreet005,229,00:20:31.680,00:20:40.650,Ben James,"there's a bunch that you can get that you could you know there's a bunch of Bollywood on like netflix nowadays, and probably on hulu to, and you know there's.",2021-05-19_benjames_videostore_transcript.vtt
mainstreet005,230,00:20:42.210,00:20:43.980,Ben James,We watch this one that's called.,2021-05-19_benjames_videostore_transcript.vtt
mainstreet005,231,00:20:45.810,00:20:47.310,Ben James,Share if I try and.,2021-05-19_benjames_videostore_transcript.vtt
mainstreet005,232,00:20:48.570,00:20:53.070,Ben James,try and save the title it's it's referred to as the DL J.,2021-05-19_benjames_videostore_transcript.vtt
mainstreet005,233,00:20:55.170,00:21:02.760,Ben James,And it translates to like the big hearted will take the bright or hang on don't do do wally Daniela jr there you go.,2021-05-19_benjames_videostore_transcript.vtt
mainstreet005,234,00:21:04.050,00:21:20.940,Ben James,"So that's it's quite dated it's because, from the 1990, I think, but it's pretty entertaining and its own in some way, but I think my favorite is lagon which is basically just.",2021-05-19_benjames_videostore_transcript.vtt
mainstreet005,235,00:21:21.060,00:21:21.660,,About.,2021-05-19_benjames_videostore_transcript.vtt
mainstreet005,236,00:21:22.800,00:21:24.810,Ben James,The British Empire getting.,2021-05-19_benjames_videostore_transcript.vtt
mainstreet005,237,00:21:26.070,00:21:30.960,Ben James,Getting beaten at cricket but it's like a Bollywood it's like a musical but like.,2021-05-19_benjames_videostore_transcript.vtt
mainstreet005,238,00:21:31.080,00:21:32.130,Ben James,People playing cricket.,2021-05-19_benjames_videostore_transcript.vtt
mainstreet005,239,00:21:32.640,00:21:34.020,Ben James,Against the rush.,2021-05-19_benjames_videostore_transcript.vtt
mainstreet005,240,00:21:34.050,00:21:38.460,Beau Newsome,And I remember that was one of our double vhs tapes.,2021-05-19_benjames_videostore_transcript.vtt
mainstreet005,241,00:21:38.820,00:21:39.420,Ben James,"Oh, there you go.",2021-05-19_benjames_videostore_transcript.vtt
mainstreet005,242,00:21:39.450,00:21:41.970,Beau Newsome,look on la GA in right.,2021-05-19_benjames_videostore_transcript.vtt
mainstreet005,243,00:21:42.210,00:21:43.110,Ben James,yeah double a yeah.,2021-05-19_benjames_videostore_transcript.vtt
mainstreet005,244,00:21:43.410,00:21:46.470,Beau Newsome,yeah yeah I always remembered look on yeah.,2021-05-19_benjames_videostore_transcript.vtt
mainstreet005,245,00:21:47.220,00:21:48.780,Beau Newsome,"yeah never, never watched it.",2021-05-19_benjames_videostore_transcript.vtt
mainstreet005,246,00:21:50.310,00:22:10.260,Ben James,You have got a ticket it just you just Google like having a look on YouTube and Look how the just put the gun in YouTube and you'll probably find there's like the main one of the main like song sequences where they like preparing to play cricket and it's just it's great.,2021-05-19_benjames_videostore_transcript.vtt
mainstreet005,247,00:22:10.440,00:22:13.260,Ben James,yeah just like yeah we'll get up like cricket.,2021-05-19_benjames_videostore_transcript.vtt
mainstreet005,248,00:22:16.140,00:22:17.250,Beau Newsome,That sounds great cool.,2021-05-19_benjames_videostore_transcript.vtt
mainstreet005,249,00:22:18.690,00:22:19.770,Beau Newsome,So you mentioned.,2021-05-19_benjames_videostore_transcript.vtt
mainstreet005,250,00:22:21.780,00:22:24.330,Beau Newsome,"Some of the movies, for your classes that.",2021-05-19_benjames_videostore_transcript.vtt
mainstreet005,251,00:22:25.410,00:22:28.260,Beau Newsome,We had in our classic SCI fi horror section.,2021-05-19_benjames_videostore_transcript.vtt
mainstreet005,252,00:22:29.010,00:22:31.410,Beau Newsome,"Okay, like fly and.",2021-05-19_benjames_videostore_transcript.vtt
mainstreet005,253,00:22:31.470,00:22:32.640,Beau Newsome,Oh yeah right they were.,2021-05-19_benjames_videostore_transcript.vtt
mainstreet005,254,00:22:32.640,00:22:34.680,Beau Newsome,Like invasion of the body snatchers.,2021-05-19_benjames_videostore_transcript.vtt
mainstreet005,255,00:22:34.740,00:22:36.030,Ben James,knife the living dead.,2021-05-19_benjames_videostore_transcript.vtt
mainstreet005,256,00:22:36.480,00:22:38.340,Ben James,"And, basically, what is that is.",2021-05-19_benjames_videostore_transcript.vtt
mainstreet005,257,00:22:38.430,00:22:39.540,Beau Newsome,that you have a favorite.,2021-05-19_benjames_videostore_transcript.vtt
mainstreet005,258,00:22:39.960,00:22:41.190,Beau Newsome,section in the store.,2021-05-19_benjames_videostore_transcript.vtt
mainstreet005,259,00:22:42.060,00:22:44.130,Ben James,"or favorite section in the store, I mean.",2021-05-19_benjames_videostore_transcript.vtt
mainstreet005,260,00:22:45.720,00:22:57.510,Ben James,"that you have a bunch of stuff in the award winners category of a cult cult section was great I love science fiction and horror, so I find myself in there all the time.",2021-05-19_benjames_videostore_transcript.vtt
mainstreet005,261,00:22:59.280,00:23:11.370,Ben James,"So yeah I don't think there's any one section that I tended towards something weird like you know i'm British, as you can tell, probably so.",2021-05-19_benjames_videostore_transcript.vtt
mainstreet005,262,00:23:12.330,00:23:26.820,Ben James,"But I never really gravitated toward because you have like a British TV section where you're just like British TV and I just never call a sore and I was like oh yeah I know that show them, just like.",2021-05-19_benjames_videostore_transcript.vtt
mainstreet005,263,00:23:27.330,00:23:27.660,,yeah.,2021-05-19_benjames_videostore_transcript.vtt
mainstreet005,264,00:23:29.250,00:23:33.870,Ben James,"So, but yeah no I you know, like all the world when is the criterion stuff is.",2021-05-19_benjames_videostore_transcript.vtt
mainstreet005,265,00:23:33.870,00:23:34.440,,brilliant.,2021-05-19_benjames_videostore_transcript.vtt
mainstreet005,266,00:23:35.550,00:23:36.630,Ben James,yeah yeah.,2021-05-19_benjames_videostore_transcript.vtt
mainstreet005,267,00:23:37.500,00:23:37.980,Ben James,yeah.,2021-05-19_benjames_videostore_transcript.vtt
mainstreet005,268,00:23:38.520,00:23:41.160,Beau Newsome,The TV any TV we rent even it was sub.,2021-05-19_benjames_videostore_transcript.vtt
mainstreet005,269,00:23:41.430,00:23:44.310,Beau Newsome,genre of animated TV.,2021-05-19_benjames_videostore_transcript.vtt
mainstreet005,270,00:23:46.380,00:23:49.770,Beau Newsome,British TV section just our TV land in general is just all.,2021-05-19_benjames_videostore_transcript.vtt
mainstreet005,271,00:23:50.880,00:23:57.630,Beau Newsome,I never saw it come and I didn't know it was going to be such a big wave that that it was you know.,2021-05-19_benjames_videostore_transcript.vtt
mainstreet005,272,00:23:59.790,00:24:02.940,Beau Newsome,That was one the hard thing for us to is so expensive to.,2021-05-19_benjames_videostore_transcript.vtt
mainstreet005,273,00:24:02.940,00:24:03.360,,buy.,2021-05-19_benjames_videostore_transcript.vtt
mainstreet005,274,00:24:04.590,00:24:10.440,Beau Newsome,season of something split it up into seven discs and then you lose one or one gets stolen or.,2021-05-19_benjames_videostore_transcript.vtt
mainstreet005,275,00:24:11.040,00:24:15.270,Beau Newsome,"or damaged it's like Okay, now we gotta, but it was.",2021-05-19_benjames_videostore_transcript.vtt
mainstreet005,276,00:24:15.930,00:24:16.470,Beau Newsome,Low right.,2021-05-19_benjames_videostore_transcript.vtt
mainstreet005,277,00:24:16.530,00:24:18.480,Ben James,yeah he never really thought about that.,2021-05-19_benjames_videostore_transcript.vtt
mainstreet005,278,00:24:19.140,00:24:20.670,Ben James,yeah right.,2021-05-19_benjames_videostore_transcript.vtt
mainstreet005,279,00:24:22.110,00:24:29.490,Ben James,And it's a mission yeah yeah no I just love I just love going in and looking around you know.,2021-05-19_benjames_videostore_transcript.vtt
mainstreet005,280,00:24:30.660,00:24:35.370,Ben James,yeah great questions the classic so the classic movies.,2021-05-19_benjames_videostore_transcript.vtt
mainstreet005,281,00:24:35.370,00:24:40.950,Ben James,"Yes, there's loads of classic lizard very classic films in there, that you know I probably wouldn't have.",2021-05-19_benjames_videostore_transcript.vtt
mainstreet005,282,00:24:42.270,00:24:50.520,Ben James,"Just because the physical copy was in front of me I was like Oh, I could just like get this right now and taking them and watch it, you know, like even yeah I think yes.",2021-05-19_benjames_videostore_transcript.vtt
mainstreet005,283,00:24:51.300,00:25:05.310,Beau Newsome,i've mentioned that in past interviews about I listened to a lot of movie podcasts to get because you know I miss being like ensconced in movies and talking to other employees talking to customers about movies.,2021-05-19_benjames_videostore_transcript.vtt
mainstreet005,284,00:25:05.670,00:25:09.090,Beau Newsome,Now I watch a movie and i'm not I don't really have anybody to share it with.,2021-05-19_benjames_videostore_transcript.vtt
mainstreet005,285,00:25:09.150,00:25:09.540,Beau Newsome,it's like.,2021-05-19_benjames_videostore_transcript.vtt
mainstreet005,286,00:25:10.170,00:25:12.450,Beau Newsome,"Oh, I could send out a text or something but.",2021-05-19_benjames_videostore_transcript.vtt
mainstreet005,287,00:25:13.470,00:25:15.000,Beau Newsome,So I kind of that's how I.,2021-05-19_benjames_videostore_transcript.vtt
mainstreet005,288,00:25:16.350,00:25:19.890,Beau Newsome,"You know, listening to podcasts but they always say in all these podcasts.",2021-05-19_benjames_videostore_transcript.vtt
mainstreet005,289,00:25:20.490,00:25:23.130,Beau Newsome,We can't get that movie anymore you can't find it anywhere.,2021-05-19_benjames_videostore_transcript.vtt
mainstreet005,290,00:25:23.550,00:25:24.420,Ben James,And oh yeah.,2021-05-19_benjames_videostore_transcript.vtt
mainstreet005,291,00:25:24.450,00:25:25.230,Beau Newsome,But we had it.,2021-05-19_benjames_videostore_transcript.vtt
mainstreet005,292,00:25:25.800,00:25:26.280,Ben James,We had.,2021-05-19_benjames_videostore_transcript.vtt
mainstreet005,293,00:25:27.030,00:25:28.020,Ben James,We had yeah.,2021-05-19_benjames_videostore_transcript.vtt
mainstreet005,294,00:25:28.050,00:25:35.190,Ben James,"yeah Oh, but if you're looking for once the pandemic is over, if you want to hang out go watch a movie i'm just let me know.",2021-05-19_benjames_videostore_transcript.vtt
mainstreet005,295,00:25:35.370,00:25:36.030,Beau Newsome,Oh yeah.,2021-05-19_benjames_videostore_transcript.vtt
mainstreet005,296,00:25:36.210,00:25:38.790,Ben James,Sure sure um what was I gonna say but.,2021-05-19_benjames_videostore_transcript.vtt
mainstreet005,297,00:25:40.110,00:25:45.270,Ben James,You said something about not being able to fine tune things oh I don't know sorry I lost my throat.,2021-05-19_benjames_videostore_transcript.vtt
mainstreet005,298,00:25:46.140,00:25:48.120,Beau Newsome,Was it something I was talking about earlier.,2021-05-19_benjames_videostore_transcript.vtt
mainstreet005,299,00:25:48.150,00:25:50.100,Ben James,yeah you were saying that they made me think of.,2021-05-19_benjames_videostore_transcript.vtt
mainstreet005,300,00:25:50.610,00:25:51.960,Ben James,Something I wanted to tell you.,2021-05-19_benjames_videostore_transcript.vtt
