objectid,transcript_line,start,end,speaker,text,txt_filename
mainstreet005,608,00:51:56.160,00:52:05.190,Ben James,"They don't really have much of a budget clearly, but they do have a wind machine or at least some fans and so, like every time somebody opens the door, they have to do this kind of like.",2021-05-19_benjames_videostore_transcript.vtt
mainstreet005,609,00:52:05.790,00:52:14.370,Ben James,comedy like wrestling with the door and like throughout the whole film they somebody just going close the JAR like.,2021-05-19_benjames_videostore_transcript.vtt
mainstreet005,610,00:52:15.870,00:52:16.890,Beau Newsome,wasn't meant to be in there.,2021-05-19_benjames_videostore_transcript.vtt
mainstreet005,611,00:52:18.780,00:52:20.100,Ben James,"it's meant to be in that, but.",2021-05-19_benjames_videostore_transcript.vtt
mainstreet005,612,00:52:20.100,00:52:21.720,Ben James,"Okay, really.",2021-05-19_benjames_videostore_transcript.vtt
mainstreet005,613,00:52:23.190,00:52:23.850,Beau Newsome,horrible.,2021-05-19_benjames_videostore_transcript.vtt
mainstreet005,614,00:52:24.870,00:52:25.170,Ben James,yeah.,2021-05-19_benjames_videostore_transcript.vtt
mainstreet005,615,00:52:25.920,00:52:31.170,Beau Newsome,"um so you said, who introduced you to the video store when you first.",2021-05-19_benjames_videostore_transcript.vtt
mainstreet005,616,00:52:32.130,00:52:34.620,Ben James,I think I think it was our friends.,2021-05-19_benjames_videostore_transcript.vtt
mainstreet005,617,00:52:36.000,00:52:39.810,Ben James,Alexandra teak who teaches poetry.,2021-05-19_benjames_videostore_transcript.vtt
mainstreet005,618,00:52:40.170,00:52:40.440,,Okay.,2021-05-19_benjames_videostore_transcript.vtt
mainstreet005,619,00:52:41.730,00:52:42.450,Ben James,Investing.,2021-05-19_benjames_videostore_transcript.vtt
mainstreet005,620,00:52:44.250,00:52:45.720,Beau Newsome,In a new store and.,2021-05-19_benjames_videostore_transcript.vtt
mainstreet005,621,00:52:47.070,00:52:48.450,Ben James,that's right she was giving.,2021-05-19_benjames_videostore_transcript.vtt
mainstreet005,622,00:52:49.980,00:52:54.090,Ben James,us that the tour she and her husband.,2021-05-19_benjames_videostore_transcript.vtt
mainstreet005,623,00:52:55.620,00:53:04.320,Ben James,"were giving us the tour of town and they're kind of you know, taking us on a walk around and and they were like in his early.",2021-05-19_benjames_videostore_transcript.vtt
mainstreet005,624,00:53:05.370,00:53:05.610,Ben James,Like.,2021-05-19_benjames_videostore_transcript.vtt
mainstreet005,625,00:53:06.600,00:53:08.010,Ben James,How yes.,2021-05-19_benjames_videostore_transcript.vtt
mainstreet005,626,00:53:09.300,00:53:09.570,Beau Newsome,yeah.,2021-05-19_benjames_videostore_transcript.vtt
mainstreet005,627,00:53:09.870,00:53:11.760,Ben James,"I remember working there, people will be like.",2021-05-19_benjames_videostore_transcript.vtt
mainstreet005,628,00:53:12.270,00:53:14.400,Beau Newsome,Wait you still work at a video store when.,2021-05-19_benjames_videostore_transcript.vtt
mainstreet005,629,00:53:14.610,00:53:15.420,Ben James,there's a video store.,2021-05-19_benjames_videostore_transcript.vtt
mainstreet005,630,00:53:16.530,00:53:16.950,Beau Newsome,again.,2021-05-19_benjames_videostore_transcript.vtt
mainstreet005,631,00:53:17.250,00:53:19.560,Ben James,You still work in the 1990s.,2021-05-19_benjames_videostore_transcript.vtt
mainstreet005,632,00:53:19.650,00:53:22.500,Beau Newsome,"Right, yes, what is this yeah.",2021-05-19_benjames_videostore_transcript.vtt
mainstreet005,633,00:53:23.100,00:53:31.380,Ben James,"yeah so honestly and this is no word of a lie, this is a clearly this was genuinely like a factor in me being like.",2021-05-19_benjames_videostore_transcript.vtt
mainstreet005,634,00:53:32.910,00:53:46.620,Ben James,"You know, because my my my wife she's like oh yeah like I could get this good job and I could we could move to this new town and like she could be really cool and you could like teach film and I can teach this and it's like.",2021-05-19_benjames_videostore_transcript.vtt
mainstreet005,635,00:53:48.900,00:53:54.330,Ben James,kind of like living in a city I don't didn't love living in Reno necessarily by like to being in a city.,2021-05-19_benjames_videostore_transcript.vtt
mainstreet005,636,00:53:55.530,00:54:01.740,Ben James,"And, and the prospect of moving to like Moscow Idaho where where where is this place.",2021-05-19_benjames_videostore_transcript.vtt
mainstreet005,637,00:54:01.770,00:54:03.570,Ben James,Where you know we're.,2021-05-19_benjames_videostore_transcript.vtt
mainstreet005,638,00:54:03.720,00:54:04.800,Beau Newsome,gonna be like yeah.,2021-05-19_benjames_videostore_transcript.vtt
mainstreet005,639,00:54:04.920,00:54:11.310,Ben James,"Right, you know, and then we got there was like a lot of stuff here, and then there, she was like this video, so I was like.",2021-05-19_benjames_videostore_transcript.vtt
mainstreet005,640,00:54:12.450,00:54:13.890,Ben James,Okay okay.,2021-05-19_benjames_videostore_transcript.vtt
mainstreet005,641,00:54:14.490,00:54:18.120,Beau Newsome,We film classes and film writing classes before you moved here.,2021-05-19_benjames_videostore_transcript.vtt
mainstreet005,642,00:54:20.340,00:54:20.880,Ben James,yeah I did.,2021-05-19_benjames_videostore_transcript.vtt
mainstreet005,643,00:54:21.150,00:54:28.770,Ben James,I did a few some kind of guest lectures that you and i've been doing kind of independent filmmaking in Reno for a while.,2021-05-19_benjames_videostore_transcript.vtt
mainstreet005,644,00:54:29.880,00:54:31.440,Ben James,"And then, in the UK before that.",2021-05-19_benjames_videostore_transcript.vtt
mainstreet005,645,00:54:31.830,00:54:34.230,Beau Newsome,But you still doing making independent films.,2021-05-19_benjames_videostore_transcript.vtt
mainstreet005,646,00:54:34.800,00:54:45.660,Ben James,"yeah we shot one just before the pandemic hits so we're in post production at the moment, and then on awake it's called which i'm developing their feature script of.",2021-05-19_benjames_videostore_transcript.vtt
mainstreet005,647,00:54:46.200,00:54:46.830,Beau Newsome,The vertical.,2021-05-19_benjames_videostore_transcript.vtt
mainstreet005,648,00:54:46.980,00:54:50.400,Ben James,i'm sorry for the week w ei ke quick.,2021-05-19_benjames_videostore_transcript.vtt
mainstreet005,649,00:54:50.970,00:54:58.410,Ben James,"Okay, and so i'm working on that the moment and have another have a bunch of.",2021-05-19_benjames_videostore_transcript.vtt
mainstreet005,650,00:54:59.730,00:55:03.300,Ben James,scripted projects there in kind of various stages of completion.,2021-05-19_benjames_videostore_transcript.vtt
mainstreet005,651,00:55:04.350,00:55:07.290,Ben James,And then i'm doing this other this other really.,2021-05-19_benjames_videostore_transcript.vtt
mainstreet005,652,00:55:07.320,00:55:09.540,Ben James,kind of bar I.,2021-05-19_benjames_videostore_transcript.vtt
mainstreet005,653,00:55:10.950,00:55:16.410,Ben James,want to call it like it's reef photography projects in collaboration with a compose a.,2021-05-19_benjames_videostore_transcript.vtt
mainstreet005,654,00:55:19.170,00:55:29.490,Ben James,"bunch of musicians and stuff when we're making i'm making these kind of video color collages of these photographs from there, frank church river of no return wilderness and.",2021-05-19_benjames_videostore_transcript.vtt
mainstreet005,655,00:55:31.260,00:55:34.290,Ben James,And friend of mine works up there actually.,2021-05-19_benjames_videostore_transcript.vtt
mainstreet005,656,00:55:34.680,00:55:36.420,Ben James,Oh really way and Nicole.,2021-05-19_benjames_videostore_transcript.vtt
mainstreet005,657,00:55:36.690,00:55:41.100,Beau Newsome,or no in the one of the ranch's chef rather ranch.,2021-05-19_benjames_videostore_transcript.vtt
mainstreet005,658,00:55:42.150,00:55:42.720,Beau Newsome,shep.,2021-05-19_benjames_videostore_transcript.vtt
mainstreet005,659,00:55:42.930,00:55:46.260,Ben James,shep ran it okay i'll have to like chef Ryan.,2021-05-19_benjames_videostore_transcript.vtt
mainstreet005,660,00:55:46.320,00:55:48.840,Beau Newsome,I didn't hit one and hit injure ranch.,2021-05-19_benjames_videostore_transcript.vtt
mainstreet005,661,00:55:49.770,00:55:50.130,Ben James,Okay.,2021-05-19_benjames_videostore_transcript.vtt
mainstreet005,662,00:55:50.160,00:55:53.610,Beau Newsome,cool and he was on my discovery did a little.,2021-05-19_benjames_videostore_transcript.vtt
mainstreet005,663,00:55:56.460,00:55:59.280,Beau Newsome,documentary or there's going to be a series.,2021-05-19_benjames_videostore_transcript.vtt
mainstreet005,664,00:56:00.090,00:56:01.920,Beau Newsome,of river of no return.,2021-05-19_benjames_videostore_transcript.vtt
mainstreet005,665,00:56:02.640,00:56:04.320,Ben James,"Oh, there is a series, I think.",2021-05-19_benjames_videostore_transcript.vtt
mainstreet005,666,00:56:04.320,00:56:05.370,Beau Newsome,yeah and it was.,2021-05-19_benjames_videostore_transcript.vtt
mainstreet005,667,00:56:05.610,00:56:07.650,Beau Newsome,Just one season and it never got picked up.,2021-05-19_benjames_videostore_transcript.vtt
mainstreet005,668,00:56:07.800,00:56:08.700,Beau Newsome,But he worked in it.,2021-05-19_benjames_videostore_transcript.vtt
mainstreet005,669,00:56:08.850,00:56:12.420,Beau Newsome,yeah he was in it is one of the guys stuff yeah.,2021-05-19_benjames_videostore_transcript.vtt
mainstreet005,670,00:56:12.720,00:56:18.270,Ben James,yeah it's a pretty pretty insane place interesting so yeah i'm working on that as well.,2021-05-19_benjames_videostore_transcript.vtt
mainstreet005,671,00:56:21.270,00:56:26.940,Beau Newsome,"Where does so, when you make a movie like wait or something do you chop it around.",2021-05-19_benjames_videostore_transcript.vtt
mainstreet005,672,00:56:26.970,00:56:28.950,Beau Newsome,"Like festivals, or how does.",2021-05-19_benjames_videostore_transcript.vtt
mainstreet005,673,00:56:28.950,00:56:31.380,Ben James,That that's right yeah that's a big plan.,2021-05-19_benjames_videostore_transcript.vtt
mainstreet005,674,00:56:31.800,00:56:43.320,Ben James,"You know, once we've finished post we're going to send it on the festival circuit and see see what we can get into basically if you know kind of aim high and see see what sticks so.",2021-05-19_benjames_videostore_transcript.vtt
mainstreet005,675,00:56:44.280,00:56:50.970,Ben James,"we're just going to you know, keep it up a shot and yeah we've got a few other things in the pipeline as well, so.",2021-05-19_benjames_videostore_transcript.vtt
mainstreet005,676,00:56:51.030,00:56:52.920,Beau Newsome,This is some you been doing since.,2021-05-19_benjames_videostore_transcript.vtt
mainstreet005,677,00:56:53.190,00:56:54.450,Beau Newsome,You lived in the UK.,2021-05-19_benjames_videostore_transcript.vtt
mainstreet005,678,00:56:55.050,00:56:56.130,Ben James,yeah you know I.,2021-05-19_benjames_videostore_transcript.vtt
mainstreet005,679,00:56:57.450,00:57:03.330,Ben James,started out just doing like music videos and adverts and things like that and i've always wanted to.,2021-05-19_benjames_videostore_transcript.vtt
mainstreet005,680,00:57:04.980,00:57:16.830,Ben James,Do an indie film really or just you know and write and direct and I love it but it's very you know it's it's quite precarious and.,2021-05-19_benjames_videostore_transcript.vtt
mainstreet005,681,00:57:18.000,00:57:25.470,Ben James,You have to always have to find the money is there's that big challenge is finding finding the money to to make the project work.,2021-05-19_benjames_videostore_transcript.vtt
mainstreet005,682,00:57:26.820,00:57:28.860,Ben James,So yeah.,2021-05-19_benjames_videostore_transcript.vtt
mainstreet005,683,00:57:29.280,00:57:30.750,Beau Newsome,You have to video sort of found but.,2021-05-19_benjames_videostore_transcript.vtt
mainstreet005,684,00:57:31.410,00:57:32.880,Beau Newsome,it's still be there to you know.,2021-05-19_benjames_videostore_transcript.vtt
mainstreet005,685,00:57:33.030,00:57:33.630,Ben James,Like.,2021-05-19_benjames_videostore_transcript.vtt
mainstreet005,686,00:57:33.690,00:57:36.270,Beau Newsome,"yeah never, never found that angel investor but.",2021-05-19_benjames_videostore_transcript.vtt
mainstreet005,687,00:57:36.690,00:57:39.930,Ben James,Right yeah exactly so just just trying to kind of.,2021-05-19_benjames_videostore_transcript.vtt
mainstreet005,688,00:57:41.160,00:57:45.360,Ben James,"But you know, one of the reasons I work as a professor as well right like I I.",2021-05-19_benjames_videostore_transcript.vtt
mainstreet005,689,00:57:47.700,00:57:52.560,Ben James,"do that, so I can I can do my creative work as well that's pretty good.",2021-05-19_benjames_videostore_transcript.vtt
mainstreet005,690,00:57:53.220,00:57:57.990,Beau Newsome,yeah that's really cool so you mentioned a keynote film festival that was.,2021-05-19_benjames_videostore_transcript.vtt
mainstreet005,691,00:57:58.440,00:58:01.950,Beau Newsome,yeah that was in Moscow or well I guess it was online.,2021-05-19_benjames_videostore_transcript.vtt
mainstreet005,692,00:58:03.210,00:58:04.980,Ben James,"Yes, so what we actually.",2021-05-19_benjames_videostore_transcript.vtt
mainstreet005,693,00:58:06.420,00:58:22.290,Ben James,"it's traditionally held at the kenworthy faith in downtown Moscow last last iteration last spring, we held it completely online because of the pandemic and and my colleague kyle how it in who's a.",2021-05-19_benjames_videostore_transcript.vtt
mainstreet005,694,00:58:23.940,00:58:27.990,Ben James,works in the in the film program as well this incredible job with like.,2021-05-19_benjames_videostore_transcript.vtt
mainstreet005,695,00:58:29.610,00:58:51.510,Ben James,"getting us a like a switcher and controlling all these different channels, so that we can like watch the films and then have Q and a's with directors and kind of zoom with the audience and and things like that, and so it was pretty great and really, really well run, so we did it again.",2021-05-19_benjames_videostore_transcript.vtt
mainstreet005,696,00:58:53.670,00:59:05.850,Ben James,"That we did again this spring, but it was kind of both online and there was an in person element as well, so Kim where they were open to I think private parties have up to 20.",2021-05-19_benjames_videostore_transcript.vtt
mainstreet005,697,00:59:06.510,00:59:16.860,Ben James,"Socially distance people, so we had an audience of you know 20 of our student filmmakers and the plus ones, and then we have.",2021-05-19_benjames_videostore_transcript.vtt
mainstreet005,698,00:59:18.120,00:59:26.610,Ben James,"Our online audience as well, so I you know you're seeing me in my this is me in my keno presenting.",2021-05-19_benjames_videostore_transcript.vtt
mainstreet005,699,00:59:26.640,00:59:28.920,Ben James,"yeah room right now like, so I was.",2021-05-19_benjames_videostore_transcript.vtt
mainstreet005,700,00:59:29.310,00:59:36.900,Ben James,"I know kind of introducing films and doing Q and a's with that, but the directors and things like that and it's really good.",2021-05-19_benjames_videostore_transcript.vtt
mainstreet005,701,00:59:37.020,00:59:39.510,Beau Newsome,it's really good oh wow that's very awesome.,2021-05-19_benjames_videostore_transcript.vtt
mainstreet005,702,00:59:40.410,00:59:45.120,Ben James,Very cool there's a lot of talent in the Pacific Northwest you know and we got lots of.,2021-05-19_benjames_videostore_transcript.vtt
mainstreet005,703,00:59:45.180,01:00:04.560,Ben James,"You know, we don't it open to anybody who's a filmmaker in the in the Pacific Northwest so if you're in or again if you're in Montana, you know, Washington and so on, so obviously I do so yeah we have people apply to submit entries from all over, and then we just we I think we chose.",2021-05-19_benjames_videostore_transcript.vtt
mainstreet005,704,01:00:04.620,01:00:06.300,Ben James,Now there's been films.,2021-05-19_benjames_videostore_transcript.vtt
mainstreet005,705,01:00:06.900,01:00:10.050,Beau Newsome,"And then, once you choose and what happens to them.",2021-05-19_benjames_videostore_transcript.vtt
mainstreet005,706,01:00:10.080,01:00:13.020,Ben James,or just yes they're receiving them all.,2021-05-19_benjames_videostore_transcript.vtt
mainstreet005,707,01:00:13.230,01:00:30.390,Ben James,"We screen them all we did them in like five blocks of three, I think, with a Q amp a between each and then they there's a panel of judges who voted best sound cinematography and best screenplay best acting.",2021-05-19_benjames_videostore_transcript.vtt
mainstreet005,708,01:00:31.620,01:00:36.660,Ben James,Best film and then there were some prizes for for for those there's audience awards as well.,2021-05-19_benjames_videostore_transcript.vtt
mainstreet005,709,01:00:37.770,01:00:39.180,Beau Newsome,"when's the next one, going to be.",2021-05-19_benjames_videostore_transcript.vtt
mainstreet005,710,01:00:39.630,01:00:43.560,Ben James,"So the next one this one's just gone, it was on last Friday.",2021-05-19_benjames_videostore_transcript.vtt
mainstreet005,711,01:00:43.740,01:00:46.680,Ben James,"that's February 14, and so it will be.",2021-05-19_benjames_videostore_transcript.vtt
mainstreet005,712,01:00:48.510,01:00:50.850,Ben James,In in white in a year's time basically.,2021-05-19_benjames_videostore_transcript.vtt
mainstreet005,713,01:00:51.120,01:00:59.430,Ben James,"Okay, we do have we yeah we do have a another event in the fall I can't remember the date of the top of my head, but.",2021-05-19_benjames_videostore_transcript.vtt
mainstreet005,714,01:01:00.600,01:01:15.930,Ben James,"I can add you to our our mailing list for 48 so there's a 48 hour film making challenge that again anyone from like local community can enter student alarm high school students, anyone who has has the.",2021-05-19_benjames_videostore_transcript.vtt
mainstreet005,715,01:01:16.770,01:01:25.710,Ben James,"desire to do it and yeah you can you just go off and you make a make a movie in 48 hours, and then they will get screened and then people when people in some prizes.",2021-05-19_benjames_videostore_transcript.vtt
mainstreet005,716,01:01:26.790,01:01:28.830,Beau Newsome,it's very cool and no idea.,2021-05-19_benjames_videostore_transcript.vtt
mainstreet005,717,01:01:30.120,01:01:31.110,Ben James,Alright cool.,2021-05-19_benjames_videostore_transcript.vtt
mainstreet005,718,01:01:31.800,01:01:42.300,Beau Newsome,um I know like keno video was a thing that I saw all the time working at the video store like i'd get magazines and stuff forward is this affiliated with that at all.,2021-05-19_benjames_videostore_transcript.vtt
mainstreet005,719,01:01:43.080,01:01:53.490,Ben James,"i've never heard of a magazine called that I just when I when I arrived here, there was Aquino film festival that was hosted at their their local theater and I was like okay.",2021-05-19_benjames_videostore_transcript.vtt
mainstreet005,720,01:01:53.580,01:01:55.140,Beau Newsome,sounds good okay yeah cuz.,2021-05-19_benjames_videostore_transcript.vtt
mainstreet005,721,01:01:55.140,01:01:56.280,Ben James,let's let's do that.,2021-05-19_benjames_videostore_transcript.vtt
mainstreet005,722,01:01:56.400,01:01:57.420,Beau Newsome,Sometimes we get.,2021-05-19_benjames_videostore_transcript.vtt
mainstreet005,723,01:01:59.220,01:02:05.760,Beau Newsome,"Like old vhs tapes of movies, or even some DVDs like I think we had an old.",2021-05-19_benjames_videostore_transcript.vtt
mainstreet005,724,01:02:07.320,01:02:11.430,Beau Newsome,Like in our critics choice section art house cinema that was.,2021-05-19_benjames_videostore_transcript.vtt
mainstreet005,725,01:02:13.050,01:02:15.330,Beau Newsome,"sponsored by like keynote Okay, I know.",2021-05-19_benjames_videostore_transcript.vtt
mainstreet005,726,01:02:16.050,01:02:18.210,Ben James,Right oh it's keno Lopez now.,2021-05-19_benjames_videostore_transcript.vtt
mainstreet005,727,01:02:19.050,01:02:20.490,Beau Newsome,"Yes, maybe.",2021-05-19_benjames_videostore_transcript.vtt
mainstreet005,728,01:02:21.060,01:02:24.540,Ben James,"You know, over seen that sit there like distribution just.",2021-05-19_benjames_videostore_transcript.vtt
mainstreet005,729,01:02:24.570,01:02:26.340,Beau Newsome,Okay yeah Maybe it was just a distributor.,2021-05-19_benjames_videostore_transcript.vtt
mainstreet005,730,01:02:28.290,01:02:29.130,Ben James,That i'm not sure.,2021-05-19_benjames_videostore_transcript.vtt
mainstreet005,731,01:02:29.220,01:02:30.450,Beau Newsome,That always recognize that.,2021-05-19_benjames_videostore_transcript.vtt
mainstreet005,732,01:02:30.510,01:02:32.640,Beau Newsome,That name so well.,2021-05-19_benjames_videostore_transcript.vtt
mainstreet005,733,01:02:33.120,01:02:37.800,Beau Newsome,"yeah synonymous with videos and movies, I know that much so.",2021-05-19_benjames_videostore_transcript.vtt
mainstreet005,734,01:02:38.010,01:02:38.430,Ben James,There you go.,2021-05-19_benjames_videostore_transcript.vtt
mainstreet005,735,01:02:39.360,01:02:45.540,Beau Newsome,cool that's very awesome Do you still keep in contact with anybody at the video store.,2021-05-19_benjames_videostore_transcript.vtt
mainstreet005,736,01:02:47.520,01:02:58.860,Ben James,"No, I don't think I knew it, you know I didn't know anybody that that well I think you're the probably the person that I am probably most familiar with other than Connor.",2021-05-19_benjames_videostore_transcript.vtt
mainstreet005,737,01:02:59.430,01:02:59.760,,Right.,2021-05-19_benjames_videostore_transcript.vtt
mainstreet005,738,01:03:00.960,01:03:06.540,Beau Newsome,Connor was mentioning he went he did the telluride film festival online.,2021-05-19_benjames_videostore_transcript.vtt
mainstreet005,739,01:03:07.080,01:03:11.730,Beau Newsome,cool so is that the the online process seems to be working OK.,2021-05-19_benjames_videostore_transcript.vtt
mainstreet005,740,01:03:12.870,01:03:18.390,Beau Newsome,"For the oh I don't know I I haven't been I haven't been to many online seven film festivals, I went to a bench.",2021-05-19_benjames_videostore_transcript.vtt
mainstreet005,741,01:03:18.480,01:03:20.580,Ben James,And well well well for real.,2021-05-19_benjames_videostore_transcript.vtt
mainstreet005,742,01:03:20.850,01:03:23.490,Ben James,"Okay, you know in person ones, and then.",2021-05-19_benjames_videostore_transcript.vtt
mainstreet005,743,01:03:24.240,01:03:46.950,Ben James,"Just since the pandemic I normally in this summer I go to a few festivals, but this summer i'm taking some time off because we're traveling and I want to get a lot of creative work done, so I think i'm just going to watch films in my in my spare time and get my get my work done ready.",2021-05-19_benjames_videostore_transcript.vtt
mainstreet005,744,01:03:47.760,01:03:52.080,Beau Newsome,I wish the video service still there to help you out with that film watching but.,2021-05-19_benjames_videostore_transcript.vtt
mainstreet005,745,01:03:52.500,01:03:55.290,Ben James,yeah but yeah me too.,2021-05-19_benjames_videostore_transcript.vtt
mainstreet005,746,01:03:57.510,01:04:01.050,Beau Newsome,"Okay, so is there anything, one thing I like to ask.",2021-05-19_benjames_videostore_transcript.vtt
mainstreet005,747,01:04:01.050,01:04:03.720,Beau Newsome,People is is there anything you've watched lately.,2021-05-19_benjames_videostore_transcript.vtt
mainstreet005,748,01:04:04.260,01:04:05.340,Beau Newsome,That you would recommend.,2021-05-19_benjames_videostore_transcript.vtt
mainstreet005,749,01:04:07.050,01:04:09.630,Ben James,um what have a watch to lately gosh.,2021-05-19_benjames_videostore_transcript.vtt
mainstreet005,750,01:04:09.900,01:04:11.400,Beau Newsome,TV movie whatever.,2021-05-19_benjames_videostore_transcript.vtt
mainstreet005,751,01:04:11.490,01:04:17.460,Ben James,yeah you know um whatever watch lately um.,2021-05-19_benjames_videostore_transcript.vtt
mainstreet005,752,01:04:20.910,01:04:24.630,Ben James,"I think the, the last thing that really.",2021-05-19_benjames_videostore_transcript.vtt
mainstreet005,753,01:04:26.970,01:04:30.690,Ben James,"couple things, the last thing that really bowled me over in terms of TV.",2021-05-19_benjames_videostore_transcript.vtt
mainstreet005,754,01:04:31.980,01:04:34.800,Ben James,was properly free bag and.,2021-05-19_benjames_videostore_transcript.vtt
mainstreet005,755,01:04:34.830,01:04:35.430,Beau Newsome,we'd love it.,2021-05-19_benjames_videostore_transcript.vtt
mainstreet005,756,01:04:36.180,01:04:43.650,Ben James,"A year or so ago now, and I have this second season of that I thought was especially good I thought that was really, really.",2021-05-19_benjames_videostore_transcript.vtt
mainstreet005,757,01:04:43.920,01:04:44.730,Beau Newsome,interesting.,2021-05-19_benjames_videostore_transcript.vtt
mainstreet005,758,01:04:44.760,01:04:47.850,Ben James,I agree to and smartly made and I.,2021-05-19_benjames_videostore_transcript.vtt
mainstreet005,759,01:04:47.850,01:04:49.020,Beau Newsome,was completely.,2021-05-19_benjames_videostore_transcript.vtt
mainstreet005,760,01:04:49.950,01:04:51.600,Ben James,yeah so good.,2021-05-19_benjames_videostore_transcript.vtt
mainstreet005,761,01:04:52.320,01:04:54.630,Ben James,"very, very fresh and interesting so.",2021-05-19_benjames_videostore_transcript.vtt
mainstreet005,762,01:04:54.990,01:04:57.180,Beau Newsome,"I might be done, I think it's done.",2021-05-19_benjames_videostore_transcript.vtt
mainstreet005,763,01:04:57.720,01:04:59.580,Ben James,"I hope, so I hope.",2021-05-19_benjames_videostore_transcript.vtt
mainstreet005,764,01:05:00.780,01:05:06.180,Ben James,"This is the thing, this is a bugbear of mine i'm like Okay, and then it's done and then just leave it alone.",2021-05-19_benjames_videostore_transcript.vtt
