objectid,transcript_line,start,end,speaker,text,txt_filename
mainstreet035,364,00:47:52.590,00:47:55.530,Monique Lillard,Do you think the library will sell those at someday.,2021-07-02_courtneyberge_videostore_transcript.vtt
mainstreet035,365,00:47:56.580,00:47:58.290,Monique Lillard,"The duplicate or not, maybe not.",2021-07-02_courtneyberge_videostore_transcript.vtt
mainstreet035,366,00:47:59.100,00:48:02.520,Courtney Berge,I don't know what the plan is.,2021-07-02_courtneyberge_videostore_transcript.vtt
mainstreet035,367,00:48:03.900,00:48:13.770,Courtney Berge,I don't know about selling because we're in special collections and there's some ethical considerations with selling things from collections.,2021-07-02_courtneyberge_videostore_transcript.vtt
mainstreet035,368,00:48:15.330,00:48:29.070,Courtney Berge,"So I don't know i'm hesitant to say that we would ever sell them i'm not sure what the plan is right, we might donate them to somewhere else, because we just don't have the space to keep.",2021-07-02_courtneyberge_videostore_transcript.vtt
mainstreet035,369,00:48:30.870,00:48:33.540,Courtney Berge,duplicates of them.,2021-07-02_courtneyberge_videostore_transcript.vtt
mainstreet035,370,00:48:33.840,00:48:40.800,Monique Lillard,And that's what I was going to ask is is did it create a space issue because that was always the issue with the stores like oh my gosh.,2021-07-02_courtneyberge_videostore_transcript.vtt
mainstreet035,371,00:48:41.130,00:48:53.490,Monique Lillard,"And I think it's an issue with libraries in general, we all just keep creating more and more and more, and there are people like me, I completely confess I like paper and I like boxes and discs things I can touch you know what.",2021-07-02_courtneyberge_videostore_transcript.vtt
mainstreet035,372,00:48:54.750,00:49:03.000,Courtney Berge,"I mean there's no kidding that it's a it's a large collection, I would say, from what I saw when it came.",2021-07-02_courtneyberge_videostore_transcript.vtt
mainstreet035,373,00:49:03.480,00:49:16.650,Courtney Berge,They were in these like movers boxes ranging in size from like a two by two by two to like a four by four by four size just piled with movies in them.,2021-07-02_courtneyberge_videostore_transcript.vtt
mainstreet035,374,00:49:17.460,00:49:33.960,Courtney Berge,"And that took a lot of space to store those while we went through them and I had to quickly go through them because we had an exhibit coming that was 14 large crates that I needed that space for to store, while we had the exhibit.",2021-07-02_courtneyberge_videostore_transcript.vtt
mainstreet035,375,00:49:35.250,00:49:43.890,Courtney Berge,"And I got it small enough now it's there's just one I think four by four box, with some odds and ends left that I need to go through.",2021-07-02_courtneyberge_videostore_transcript.vtt
mainstreet035,376,00:49:45.180,00:49:50.280,Courtney Berge,But we put them all in bankers boxes basically.,2021-07-02_courtneyberge_videostore_transcript.vtt
mainstreet035,377,00:49:51.330,00:49:52.050,Courtney Berge,and,2021-07-02_courtneyberge_videostore_transcript.vtt
mainstreet035,378,00:49:54.300,00:49:57.360,Courtney Berge,if memory serves its at.,2021-07-02_courtneyberge_videostore_transcript.vtt
mainstreet035,379,00:49:58.950,00:49:59.670,,let's see.,2021-07-02_courtneyberge_videostore_transcript.vtt
mainstreet035,380,00:50:02.730,00:50:07.860,Courtney Berge,612 2430.,2021-07-02_courtneyberge_videostore_transcript.vtt
mainstreet035,381,00:50:09.000,00:50:13.860,Courtney Berge,Between 30 and 40 cubic feet and that's not including the duplicates that I pulled.,2021-07-02_courtneyberge_videostore_transcript.vtt
mainstreet035,382,00:50:14.280,00:50:15.810,Courtney Berge,wow uh huh.,2021-07-02_courtneyberge_videostore_transcript.vtt
mainstreet035,383,00:50:17.460,00:50:19.560,Monique Lillard,You said what did you just say how many cubic feet.,2021-07-02_courtneyberge_videostore_transcript.vtt
mainstreet035,384,00:50:19.800,00:50:29.580,Courtney Berge,Like 30 or 40 between 30 and 40 cubic feet that's a lot um or at least that's how we measure it because the boxes are about.,2021-07-02_courtneyberge_videostore_transcript.vtt
mainstreet035,385,00:50:30.930,00:50:39.780,Courtney Berge,"One foot cubic squared and I was able to fit a fair number of DVDs in those boxes, but and I packed them as.",2021-07-02_courtneyberge_videostore_transcript.vtt
mainstreet035,386,00:50:40.980,00:50:52.050,Courtney Berge,"geometrically like Timothy as I possibly could to get the most use out of them, but it's still a lot of space and we have a finite amount of space.",2021-07-02_courtneyberge_videostore_transcript.vtt
mainstreet035,387,00:50:52.530,00:51:02.850,Courtney Berge,"So we always consider very because we get offers have a lot of collections and if it's a very large collection, we have to consider very carefully whether we can accept it because.",2021-07-02_courtneyberge_videostore_transcript.vtt
mainstreet035,388,00:51:03.360,00:51:10.110,Courtney Berge,of space space constraints and future growth and whether we're proper to where you're properly able to take care of it.,2021-07-02_courtneyberge_videostore_transcript.vtt
mainstreet035,389,00:51:11.250,00:51:17.250,Monique Lillard,"Interesting very interesting now tell me the history of the oral history, then, whose idea was it and.",2021-07-02_courtneyberge_videostore_transcript.vtt
mainstreet035,390,00:51:18.540,00:51:27.090,Monique Lillard,"I hope was enough since it's coming to an end the interview section of it, I hope, we've been doing what you wanted, but were you and whose idea was it, how did it work.",2021-07-02_courtneyberge_videostore_transcript.vtt
mainstreet035,391,00:51:27.600,00:51:28.140,,um.,2021-07-02_courtneyberge_videostore_transcript.vtt
mainstreet035,392,00:51:29.670,00:51:44.430,Courtney Berge,"I don't remember who came up with the idea first when we when it was decided, we were going to receive the collection of a group of people Librarians and staff at the library we form like a little committee and we discussed.",2021-07-02_courtneyberge_videostore_transcript.vtt
mainstreet035,393,00:51:45.450,00:51:57.390,Courtney Berge,"possibilities for like what we could do to enhance the collection, because we knew it would be a while before or if we would be able to like lend them out or do anything with them were like we want.",2021-07-02_courtneyberge_videostore_transcript.vtt
mainstreet035,394,00:51:57.930,00:52:06.810,Courtney Berge,"We want to make this collection, accessible and we want people to kind of know that it is here and it's not all of it, but like we.",2021-07-02_courtneyberge_videostore_transcript.vtt
mainstreet035,395,00:52:07.830,00:52:08.220,Courtney Berge,How would you.,2021-07-02_courtneyberge_videostore_transcript.vtt
mainstreet035,396,00:52:08.730,00:52:09.150,Monique Lillard,feel good.,2021-07-02_courtneyberge_videostore_transcript.vtt
mainstreet035,397,00:52:09.360,00:52:14.160,Monique Lillard,"yeah apple very happy nobody knows it's as many as 14,000 i'll just tell you that and.",2021-07-02_courtneyberge_videostore_transcript.vtt
mainstreet035,398,00:52:14.190,00:52:14.370,Courtney Berge,yeah.,2021-07-02_courtneyberge_videostore_transcript.vtt
mainstreet035,399,00:52:14.730,00:52:17.580,Monique Lillard,And it makes us all think oh good yeah.,2021-07-02_courtneyberge_videostore_transcript.vtt
mainstreet035,400,00:52:18.150,00:52:27.240,Courtney Berge,"yeah it's like whoa like we didn't get it all, because I think it was like 30 or 40,000 titles, to start with her, it was a lie um.",2021-07-02_courtneyberge_videostore_transcript.vtt
mainstreet035,401,00:52:28.170,00:52:48.750,Courtney Berge,"But we wanted people to know that it was you know we cared and like it's a part of our history and like that's what we wanted, I think, in that community in that initial it was a zoom meeting cuz it was early, it was the early coven times and there were.",2021-07-02_courtneyberge_videostore_transcript.vtt
mainstreet035,402,00:52:51.120,00:53:11.700,Courtney Berge,"I don't know 10 to 20 people in that first meeting, and we were all kind of like bit balling ideas of like something we're like someday we could do a podcast and you know, do something and others were like we could do movie nights and I don't remember who said the oral history.",2021-07-02_courtneyberge_videostore_transcript.vtt
mainstreet035,403,00:53:13.740,00:53:30.960,Courtney Berge,"First, but we all liked that idea and we're like well, maybe the oral history could then inform the podcast and we're going to create a digital collection like with all of these these interviews, so people can reminisce and and kind of understand what the video store was like and.",2021-07-02_courtneyberge_videostore_transcript.vtt
mainstreet035,404,00:53:34.080,00:53:38.340,Courtney Berge,"Then the final product we're not sure what it'll fully look like, but.",2021-07-02_courtneyberge_videostore_transcript.vtt
mainstreet035,405,00:53:39.630,00:53:41.340,Courtney Berge,The intent was to.,2021-07-02_courtneyberge_videostore_transcript.vtt
mainstreet035,406,00:53:42.510,00:53:50.580,Courtney Berge,To kind of preserve the unimportant part like 30 ish year aspect of Moscow history.,2021-07-02_courtneyberge_videostore_transcript.vtt
mainstreet035,407,00:53:52.020,00:53:52.620,Courtney Berge,40,2021-07-02_courtneyberge_videostore_transcript.vtt
mainstreet035,408,00:53:52.710,00:53:54.720,Courtney Berge,and shared before yeah.,2021-07-02_courtneyberge_videostore_transcript.vtt
mainstreet035,409,00:53:56.130,00:54:01.080,Monique Lillard,"Well, people i've spoken to have really enjoyed participating and at.",2021-07-02_courtneyberge_videostore_transcript.vtt
mainstreet035,410,00:54:02.280,00:54:13.290,Monique Lillard,Some have been brought to tears just remembering the nostalgia of watching with their children watching with their parents watching with their siblings the family rituals of negotiation.,2021-07-02_courtneyberge_videostore_transcript.vtt
mainstreet035,411,00:54:14.460,00:54:19.200,Monique Lillard,And then watching and anticipation and.,2021-07-02_courtneyberge_videostore_transcript.vtt
mainstreet035,412,00:54:20.880,00:54:28.680,Monique Lillard,"Everything you've actually just described, so I think the oral history was a very good idea, and for those of us who were.",2021-07-02_courtneyberge_videostore_transcript.vtt
mainstreet035,413,00:54:29.640,00:54:37.530,Monique Lillard,very involved with the project it's actually bought me a certain sense of peace in terms of we we did all we could I eventually.,2021-07-02_courtneyberge_videostore_transcript.vtt
mainstreet035,414,00:54:38.130,00:54:50.550,Monique Lillard,"got off the board, and then the people who remain the boy Lauretta Campbell in particular oh my gosh she worked so hard Melissa swab it for oh so hard to try to make it work, you know and.",2021-07-02_courtneyberge_videostore_transcript.vtt
mainstreet035,415,00:54:51.900,00:54:55.560,Monique Lillard,"It was what it was you know, it was an era, and it was what it was so.",2021-07-02_courtneyberge_videostore_transcript.vtt
mainstreet035,416,00:54:56.910,00:54:59.220,Monique Lillard,10 data cheerful note.,2021-07-02_courtneyberge_videostore_transcript.vtt
mainstreet035,417,00:55:00.390,00:55:06.690,Monique Lillard,Happy memories of the store weird memories odd memories goofy memories.,2021-07-02_courtneyberge_videostore_transcript.vtt
mainstreet035,418,00:55:08.430,00:55:09.240,Courtney Berge,I.,2021-07-02_courtneyberge_videostore_transcript.vtt
mainstreet035,419,00:55:10.320,00:55:17.580,Courtney Berge,The only one that I kind of have is um I saw the movie Santa do.,2021-07-02_courtneyberge_videostore_transcript.vtt
mainstreet035,420,00:55:18.630,00:55:20.040,Courtney Berge,Have you seen Zanna do.,2021-07-02_courtneyberge_videostore_transcript.vtt
mainstreet035,421,00:55:20.400,00:55:26.730,Monique Lillard,"I guess once I can hear olivia Newton john singing the song I almost broke into it, but i'll spare the history that.",2021-07-02_courtneyberge_videostore_transcript.vtt
mainstreet035,422,00:55:27.120,00:55:37.050,Courtney Berge,"I got it because it was want to gain kelly's final movies, I forgot that, and so I watched it and it's a trip it's.",2021-07-02_courtneyberge_videostore_transcript.vtt
mainstreet035,423,00:55:38.190,00:55:40.050,Courtney Berge,A bizarre little film.,2021-07-02_courtneyberge_videostore_transcript.vtt
mainstreet035,424,00:55:41.220,00:55:57.210,Courtney Berge,"I love it and I remember telling my friend about it, and I was like I think you would like Santa do we should watch it, and this is actually probably one of the it was in the last year or two before the store and and my friend watched it and she loved it.",2021-07-02_courtneyberge_videostore_transcript.vtt
mainstreet035,425,00:55:58.230,00:56:02.430,Courtney Berge,And she was like this is my new favorite movie is just so good.,2021-07-02_courtneyberge_videostore_transcript.vtt
mainstreet035,426,00:56:03.990,00:56:12.240,Courtney Berge,And then she got to get her movie choices on the wall of thing are the impacts.,2021-07-02_courtneyberge_videostore_transcript.vtt
mainstreet035,427,00:56:12.330,00:56:13.770,Monique Lillard,She do the trivia question he.,2021-07-02_courtneyberge_videostore_transcript.vtt
mainstreet035,428,00:56:13.770,00:56:19.050,Courtney Berge,knew the trivia and she got picked she was so excited that's for like shining moment.,2021-07-02_courtneyberge_videostore_transcript.vtt
mainstreet035,429,00:56:21.570,00:56:34.890,Courtney Berge,And she put Zanna do up she's like he got you know I put Zanna do up there and i'm like as you should like no one's gonna pick Zanna do unless you like weird disco roller skating movies.,2021-07-02_courtneyberge_videostore_transcript.vtt
mainstreet035,430,00:56:36.510,00:56:41.520,Courtney Berge,which I feel like there aren't that many people who like that's the genre that they're going for is.,2021-07-02_courtneyberge_videostore_transcript.vtt
mainstreet035,431,00:56:43.170,00:56:46.080,Courtney Berge,But that that was that was a happy moment.,2021-07-02_courtneyberge_videostore_transcript.vtt
mainstreet035,432,00:56:47.250,00:56:58.800,Monique Lillard,"You know what's funny is what I think it's added to I think of what the cover looks like I might have to Google it and see if i'm remembering right, but my guess is the reason I can see that cover is because I saw her pick that's My guess, I mean I.",2021-07-02_courtneyberge_videostore_transcript.vtt
mainstreet035,433,00:56:59.430,00:57:06.870,Courtney Berge,play and then she went out and bought it after Howard Hughes closed because she's like I have to own Zanna do yes.,2021-07-02_courtneyberge_videostore_transcript.vtt
mainstreet035,434,00:57:07.620,00:57:08.940,Monique Lillard,that's a wonderful story.,2021-07-02_courtneyberge_videostore_transcript.vtt
mainstreet035,435,00:57:09.210,00:57:09.600,,yeah.,2021-07-02_courtneyberge_videostore_transcript.vtt
mainstreet035,436,00:57:10.920,00:57:13.290,Monique Lillard,Anything else other stories other memories.,2021-07-02_courtneyberge_videostore_transcript.vtt
mainstreet035,437,00:57:14.700,00:57:21.090,Courtney Berge,"I remember getting the trivia wrong, the law, I never cheated, I never like tried to Google it or anything.",2021-07-02_courtneyberge_videostore_transcript.vtt
mainstreet035,438,00:57:22.500,00:57:24.150,Courtney Berge,I was just did my best bet.,2021-07-02_courtneyberge_videostore_transcript.vtt
mainstreet035,439,00:57:24.390,00:57:26.040,Monique Lillard,Those were hard trivia questions.,2021-07-02_courtneyberge_videostore_transcript.vtt
mainstreet035,440,00:57:26.310,00:57:28.170,Monique Lillard,They were I never got one right so.,2021-07-02_courtneyberge_videostore_transcript.vtt
mainstreet035,441,00:57:28.890,00:57:43.440,Courtney Berge,"I think I might have gotten one right a long time ago, but it was before you had like the option to get your PIC on the wall like that wasn't it was just I feel like at one point, it was just a pride thing, and there was no like.",2021-07-02_courtneyberge_videostore_transcript.vtt
mainstreet035,442,00:57:44.970,00:57:54.120,Courtney Berge,"You might have gotten maybe a free rental or something I don't remember, but I feel like I might have gotten one of those right or I was close.",2021-07-02_courtneyberge_videostore_transcript.vtt
mainstreet035,443,00:57:55.650,00:57:56.310,Courtney Berge,um.,2021-07-02_courtneyberge_videostore_transcript.vtt
mainstreet035,444,00:58:00.930,00:58:16.950,Courtney Berge,"I just I remember those early days like I memories aren't my strong suit I don't have a lot of strong memories from my life, some people always seem to be able to recall them really well like when I was four this happened and i'm like I don't remember.",2021-07-02_courtneyberge_videostore_transcript.vtt
mainstreet035,445,00:58:17.970,00:58:27.540,Courtney Berge,about my life when I was four but those first years when I would go on on Thursdays and just like going through the classics.,2021-07-02_courtneyberge_videostore_transcript.vtt
mainstreet035,446,00:58:29.790,00:58:37.200,Courtney Berge,"Those were really very happy times, it was like a time of discovery and I was figuring out my own tastes and.",2021-07-02_courtneyberge_videostore_transcript.vtt
mainstreet035,447,00:58:39.300,00:58:53.670,Courtney Berge,"learning about like what I liked in film and what I did it and, like watching movies other people would suggest, and being like I don't like that, but I liked this, but no one else likes this but that's okay um I do remember.",2021-07-02_courtneyberge_videostore_transcript.vtt
mainstreet035,448,00:58:55.740,00:58:57.960,Courtney Berge,When I was getting into foreign film.,2021-07-02_courtneyberge_videostore_transcript.vtt
mainstreet035,449,00:59:00.840,00:59:19.740,Courtney Berge,"Howard Hughes had a movie that I had seen when I was studying abroad and it's this weird surrealist movie that I really want to watch again, but I can't find anywhere um and I wish I could I could watch that but what's it called Do you remember called daisies.",2021-07-02_courtneyberge_videostore_transcript.vtt
mainstreet035,450,00:59:21.840,00:59:25.890,Courtney Berge,it's the 1960s trek new wave phil.,2021-07-02_courtneyberge_videostore_transcript.vtt
mainstreet035,451,00:59:26.130,00:59:27.870,Monique Lillard,New wave all right.,2021-07-02_courtneyberge_videostore_transcript.vtt
mainstreet035,452,00:59:27.900,00:59:29.550,Monique Lillard,yeah uh huh.,2021-07-02_courtneyberge_videostore_transcript.vtt
mainstreet035,453,00:59:32.220,00:59:33.300,Monique Lillard,wonder where it is.,2021-07-02_courtneyberge_videostore_transcript.vtt
mainstreet035,454,00:59:34.470,00:59:38.010,Courtney Berge,This is not a company must have bought it I don't think it was a criterion.,2021-07-02_courtneyberge_videostore_transcript.vtt
mainstreet035,455,00:59:38.190,00:59:43.620,Courtney Berge,It might be I just remembered in the check section of the foreign film.,2021-07-02_courtneyberge_videostore_transcript.vtt
mainstreet035,456,00:59:43.650,00:59:45.360,Monique Lillard,yeah that it probably wasn't that's interesting.,2021-07-02_courtneyberge_videostore_transcript.vtt
mainstreet035,457,00:59:46.020,00:59:51.690,Monique Lillard,"I heard that the kenworthy kept all the criterion and they kept the French movies, I heard so.",2021-07-02_courtneyberge_videostore_transcript.vtt
mainstreet035,458,00:59:51.750,00:59:57.840,Courtney Berge,"That sounds right yeah I wish I could have gotten my hands on the check movies in the movies, but.",2021-07-02_courtneyberge_videostore_transcript.vtt
mainstreet035,459,00:59:59.070,01:00:03.150,Monique Lillard,"You know, you could check with Jamie hill who.",2021-07-02_courtneyberge_videostore_transcript.vtt
mainstreet035,460,01:00:04.530,01:00:06.720,Monique Lillard,"was in charge of this for the weekend, which you know who she is.",2021-07-02_courtneyberge_videostore_transcript.vtt
mainstreet035,461,01:00:07.680,01:00:08.640,Courtney Berge,i've heard the name.,2021-07-02_courtneyberge_videostore_transcript.vtt
mainstreet035,462,01:00:08.670,01:00:12.810,Monique Lillard,"yeah yeah yeah you could check with her, she may or may not know.",2021-07-02_courtneyberge_videostore_transcript.vtt
mainstreet035,463,01:00:13.410,01:00:13.980,,yeah.,2021-07-02_courtneyberge_videostore_transcript.vtt
mainstreet035,464,01:00:16.680,01:00:23.820,Courtney Berge,"Go ahead, I was gonna say just my memories of friends and stuff they're all happy I don't have a big one yeah yeah.",2021-07-02_courtneyberge_videostore_transcript.vtt
mainstreet035,465,01:00:25.110,01:00:32.940,Monique Lillard,"Anything else I should have asked and I asked that of everybody, but that's especially true since you were sort of part of the formation of this history so um.",2021-07-02_courtneyberge_videostore_transcript.vtt
mainstreet035,466,01:00:36.270,01:00:37.470,Courtney Berge,No okay.,2021-07-02_courtneyberge_videostore_transcript.vtt
mainstreet035,467,01:00:37.560,01:00:44.610,Monique Lillard,"So, as I said, if something comes to your mind it's completely easy to set this up, and we can just you know, part two.",2021-07-02_courtneyberge_videostore_transcript.vtt
mainstreet035,468,01:00:47.400,01:00:58.410,Monique Lillard,"And, and we can talk about this once we stop recording, but we are still recording at the moment is there is there anybody else you think we should be speaking to because i've got a few more about another week on my.",2021-07-02_courtneyberge_videostore_transcript.vtt
mainstreet035,469,01:01:02.280,01:01:06.420,Courtney Berge,"Have you talked to a lot of people who bought movies, through the sale.",2021-07-02_courtneyberge_videostore_transcript.vtt
mainstreet035,470,01:01:07.050,01:01:11.940,Monique Lillard,Some songs not a lot I I heard that there were sort of.,2021-07-02_courtneyberge_videostore_transcript.vtt
mainstreet035,471,01:01:13.980,01:01:24.930,Monique Lillard,"groups of people and, of course, this was all virtual because we were all on lockdown when when this was starting and then it would then we're sort of finding our way last summer, so there were a bunch of science fiction buffs, for example.",2021-07-02_courtneyberge_videostore_transcript.vtt
mainstreet035,472,01:01:24.960,01:01:25.500,Courtney Berge,who apparently.,2021-07-02_courtneyberge_videostore_transcript.vtt
mainstreet035,473,01:01:25.740,01:01:27.960,Monique Lillard,Really excited about the kenworthy sale.,2021-07-02_courtneyberge_videostore_transcript.vtt
mainstreet035,474,01:01:29.280,01:01:32.820,Monique Lillard,"And I don't know how they found out about it, but then they must have told each other and then.",2021-07-02_courtneyberge_videostore_transcript.vtt
mainstreet035,475,01:01:32.820,01:01:33.210,Courtney Berge,There was.,2021-07-02_courtneyberge_videostore_transcript.vtt
mainstreet035,476,01:01:34.530,01:01:48.630,Monique Lillard,"Not quite competition but I remember thinking they almost could have done an auction, because I think that they might have raised the price if they if they wanted to play that way, but I think trying to work that out would have been just logistically impossible, but but.",2021-07-02_courtneyberge_videostore_transcript.vtt
mainstreet035,477,01:01:50.310,01:01:59.190,Monique Lillard,"i've heard about that I have not talked to anybody who participated in that type of buying So if you know somebody in particular, let me know i've got.",2021-07-02_courtneyberge_videostore_transcript.vtt
mainstreet035,478,01:01:59.430,01:02:03.810,Courtney Berge,Anyone who did that sort of thing I just know people who bought a bunch of Middle East.,2021-07-02_courtneyberge_videostore_transcript.vtt
mainstreet035,479,01:02:04.470,01:02:06.630,Monique Lillard,"How did they do it, what what went on.",2021-07-02_courtneyberge_videostore_transcript.vtt
mainstreet035,480,01:02:06.960,01:02:14.940,Courtney Berge,"I think they just went through the list, they went through the list, they just went through the list and they picked out the titles that they wanted or thought they wanted.",2021-07-02_courtneyberge_videostore_transcript.vtt
mainstreet035,481,01:02:16.140,01:02:17.310,Courtney Berge,And then they got them.,2021-07-02_courtneyberge_videostore_transcript.vtt
mainstreet035,482,01:02:18.360,01:02:33.240,Courtney Berge,"And then they watched them all, and they have, I know that they have piles of ones that they want to keep and ones that they're like i'm not I don't want to watch these get and I told them not to throw those away yet, because I haven't decided whether or not.",2021-07-02_courtneyberge_videostore_transcript.vtt
mainstreet035,483,01:02:34.950,01:02:45.870,Courtney Berge,"I had in my head that people who did that who got these movies, and then decided they didn't want them, they could donate them to the library, but that was before I realize just how much space.",2021-07-02_courtneyberge_videostore_transcript.vtt
mainstreet035,484,01:02:47.040,01:03:00.870,Courtney Berge,"The DVDs take, and so I don't think that's plausible but I don't want them to get rid of them, yet, because I want to figure out some way to to to make them accessible to others and some some sort of format.",2021-07-02_courtneyberge_videostore_transcript.vtt
mainstreet035,485,01:03:01.260,01:03:03.750,Monique Lillard,good for you i'm thinking that Chairman i'm what.,2021-07-02_courtneyberge_videostore_transcript.vtt
mainstreet035,486,01:03:05.070,01:03:06.090,Monique Lillard,"Facebook, is the.",2021-07-02_courtneyberge_videostore_transcript.vtt
mainstreet035,487,01:03:07.230,01:03:17.790,Monique Lillard,"or next door are two huge ways to get to or the local newspaper, of course, you know hitting all three and forming a group I don't know if that would work or not I don't know.",2021-07-02_courtneyberge_videostore_transcript.vtt
