objectid,transcript_line,start,end,speaker,text,txt_filename
mainstreet005,301,00:25:53.190,00:25:54.150,Ben James,Okay nope.,2021-05-19_benjames_videostore_transcript.vtt
mainstreet005,302,00:25:54.840,00:25:55.650,Beau Newsome,No problem.,2021-05-19_benjames_videostore_transcript.vtt
mainstreet005,303,00:25:56.910,00:26:05.430,Beau Newsome,"So you, you mentioned, can you maybe go over some of the horror cinema movies, that you, you talked about your horror cinema class.",2021-05-19_benjames_videostore_transcript.vtt
mainstreet005,304,00:26:05.550,00:26:13.890,Ben James,"Oh yeah absolutely yeah so I love horror i'm a huge huge fan of horror movie enough because they're really interesting, I think.",2021-05-19_benjames_videostore_transcript.vtt
mainstreet005,305,00:26:14.910,00:26:16.710,Beau Newsome,See they freaked me out too much.,2021-05-19_benjames_videostore_transcript.vtt
mainstreet005,306,00:26:16.770,00:26:18.570,Ben James,For some reason yeah I get a little.,2021-05-19_benjames_videostore_transcript.vtt
mainstreet005,307,00:26:19.230,00:26:20.790,Beau Newsome,psychologically involved in.,2021-05-19_benjames_videostore_transcript.vtt
mainstreet005,308,00:26:21.150,00:26:39.000,Ben James,"What yeah okay that's fair enough, I think I watched a bunch of horror, I like slightly too early, when I was a kid and it kind of gave me this fixation where I was like kind of became fascinated with the experience of being scared like I became really interested in like.",2021-05-19_benjames_videostore_transcript.vtt
mainstreet005,309,00:26:40.530,00:26:52.050,Ben James,Because I remember you know early horror film watching you know horror films early on and just being incapable of watching I found that fascinating that I was like it was just like.,2021-05-19_benjames_videostore_transcript.vtt
mainstreet005,310,00:26:53.310,00:27:00.090,Ben James,"It wasn't a choice that I was making like my body wouldn't let me, what did I mean like.",2021-05-19_benjames_videostore_transcript.vtt
mainstreet005,311,00:27:00.450,00:27:00.750,Ben James,Like.,2021-05-19_benjames_videostore_transcript.vtt
mainstreet005,312,00:27:00.780,00:27:05.040,Ben James,I didn't have a choice like I just like literally couldn't physically be in the room.,2021-05-19_benjames_videostore_transcript.vtt
mainstreet005,313,00:27:05.310,00:27:08.340,Beau Newsome,Do you remember one movie standing out the stairs you as a kid that.,2021-05-19_benjames_videostore_transcript.vtt
mainstreet005,314,00:27:08.760,00:27:10.860,Ben James,"I mean, I think I watched.",2021-05-19_benjames_videostore_transcript.vtt
mainstreet005,315,00:27:13.590,00:27:24.300,Ben James,"My dad rented alien and I watched some of it from the stairs when I shouldn't have that was early on, I was quite young.",2021-05-19_benjames_videostore_transcript.vtt
mainstreet005,316,00:27:25.530,00:27:31.470,Ben James,"I don't think he knew that I was watching me from the leg through the door, so I think.",2021-05-19_benjames_videostore_transcript.vtt
mainstreet005,317,00:27:32.940,00:27:36.450,Beau Newsome,that's a hotly than a movie to about whether it's SCI fi or or.,2021-05-19_benjames_videostore_transcript.vtt
mainstreet005,318,00:27:37.470,00:27:38.010,Ben James,Its books.,2021-05-19_benjames_videostore_transcript.vtt
mainstreet005,319,00:27:38.040,00:27:39.030,Beau Newsome,I yeah I think it's.,2021-05-19_benjames_videostore_transcript.vtt
mainstreet005,320,00:27:40.980,00:27:42.750,Ben James,terrifying space yeah.,2021-05-19_benjames_videostore_transcript.vtt
mainstreet005,321,00:27:42.960,00:27:45.630,Ben James,it's truck as in space and then it's jewels in space.,2021-05-19_benjames_videostore_transcript.vtt
mainstreet005,322,00:27:45.930,00:27:51.540,Ben James,Right um so yeah so that and then I saw this weird.,2021-05-19_benjames_videostore_transcript.vtt
mainstreet005,323,00:27:53.070,00:27:53.730,Ben James,weird.,2021-05-19_benjames_videostore_transcript.vtt
mainstreet005,324,00:27:54.960,00:28:00.870,Ben James,kind of what dark fantasy movie called in in the company of wolves.,2021-05-19_benjames_videostore_transcript.vtt
mainstreet005,325,00:28:02.190,00:28:04.200,Ben James,As Angela lansbury in it.,2021-05-19_benjames_videostore_transcript.vtt
mainstreet005,326,00:28:04.290,00:28:07.500,Ben James,"And there's this horrific scene, basically, where this guy.",2021-05-19_benjames_videostore_transcript.vtt
mainstreet005,327,00:28:09.990,00:28:20.490,Ben James,"gets a pan of it's like a medieval kind of fantasy setting this guy gets a pan of hot water thrown thrown at him and he, like pulls his skin off and then a wolf comes off his back.",2021-05-19_benjames_videostore_transcript.vtt
mainstreet005,328,00:28:22.170,00:28:25.380,Ben James,And I watched that when I was a kid and I was just like oh.,2021-05-19_benjames_videostore_transcript.vtt
mainstreet005,329,00:28:27.210,00:28:31.470,Ben James,And I like ran I ran like screaming out of the room.,2021-05-19_benjames_videostore_transcript.vtt
mainstreet005,330,00:28:32.190,00:28:37.410,Beau Newsome,"remember how you consume movies, back then, was it just it was my yeah my dad.",2021-05-19_benjames_videostore_transcript.vtt
mainstreet005,331,00:28:38.190,00:28:48.690,Ben James,"I want with watch them on TV, sometimes, and I would record them off TV my dad would record movies, of the TV and he had like a.",2021-05-19_benjames_videostore_transcript.vtt
mainstreet005,332,00:28:49.140,00:29:08.760,Ben James,"There was a cabinet underneath a vhs player that have just a ton of vhs tapes in it, and so, sometimes when I was like home by myself, you know, whatever i'd be watching the flintstones or whatever it was on tape and I like or stolen or which That was all of the time.",2021-05-19_benjames_videostore_transcript.vtt
mainstreet005,333,00:29:10.350,00:29:22.470,Ben James,"You know, on tape and then I would take that out of the machine and then i'd be like well what else is here, and then i'd start kind of you know, just like searching through all these all these weird movies, and I was like I had.",2021-05-19_benjames_videostore_transcript.vtt
mainstreet005,334,00:29:24.450,00:29:30.750,Ben James,"Smoking the bandit was like Oh, this is pretty cool but like it didn't understand a lot of the stuff in it and then like.",2021-05-19_benjames_videostore_transcript.vtt
mainstreet005,335,00:29:32.370,00:29:39.000,Ben James,"Some clint Eastwood movies, and then there was this oh what's the.",2021-05-19_benjames_videostore_transcript.vtt
mainstreet005,336,00:29:41.010,00:29:44.100,Ben James,what's the Madonna movie the first.,2021-05-19_benjames_videostore_transcript.vtt
mainstreet005,337,00:29:44.520,00:29:45.990,Beau Newsome,desperately seeking Susan.,2021-05-19_benjames_videostore_transcript.vtt
mainstreet005,338,00:29:46.110,00:29:49.920,Ben James,desperately seeking Susan i've been like I do not understand this.,2021-05-19_benjames_videostore_transcript.vtt
mainstreet005,339,00:29:50.340,00:29:53.970,Ben James,Soon you're watching tootsie when I was a kid it was being like.,2021-05-19_benjames_videostore_transcript.vtt
mainstreet005,340,00:29:54.510,00:29:56.100,Ben James,"Okay, this is pretty cool yeah.",2021-05-19_benjames_videostore_transcript.vtt
mainstreet005,341,00:29:56.160,00:29:57.570,Beau Newsome,yeah just.,2021-05-19_benjames_videostore_transcript.vtt
mainstreet005,342,00:29:57.990,00:30:06.390,Ben James,"Like all these kind of like 70s 80s yeah movies, that my dad had taped off the TV and I was just like I just.",2021-05-19_benjames_videostore_transcript.vtt
mainstreet005,343,00:30:07.860,00:30:15.660,Ben James,"watch them kind of by accident and then yeah one day, I came across in the company of walls and just scared in cheeses that I myself.",2021-05-19_benjames_videostore_transcript.vtt
mainstreet005,344,00:30:16.110,00:30:17.580,Ben James,Really so.,2021-05-19_benjames_videostore_transcript.vtt
mainstreet005,345,00:30:17.640,00:30:21.750,Beau Newsome,"Do you remember, if the video store have that i'm trying to picture what it looked like.",2021-05-19_benjames_videostore_transcript.vtt
mainstreet005,346,00:30:22.170,00:30:22.560,Ben James,ever.,2021-05-19_benjames_videostore_transcript.vtt
mainstreet005,347,00:30:22.680,00:30:23.970,Ben James,yeah i'll have to gosh.,2021-05-19_benjames_videostore_transcript.vtt
mainstreet005,348,00:30:24.420,00:30:24.960,Beau Newsome,look it up.,2021-05-19_benjames_videostore_transcript.vtt
mainstreet005,349,00:30:25.260,00:30:33.390,Ben James,But it's it's a quite an unusual movie it has this a lot of yeah kind of psychedelic kind of like fantasy.,2021-05-19_benjames_videostore_transcript.vtt
mainstreet005,350,00:30:34.440,00:30:36.420,Ben James,kind of hard work quite Gothic.,2021-05-19_benjames_videostore_transcript.vtt
mainstreet005,351,00:30:36.930,00:30:38.190,Beau Newsome,As the ground again.,2021-05-19_benjames_videostore_transcript.vtt
mainstreet005,352,00:30:38.790,00:30:40.680,Ben James,in the company of wolves.,2021-05-19_benjames_videostore_transcript.vtt
mainstreet005,353,00:30:40.860,00:30:41.280,,Okay.,2021-05-19_benjames_videostore_transcript.vtt
mainstreet005,354,00:30:42.360,00:30:46.020,Ben James,not to be confused with the brotherhood of the world which is this French.,2021-05-19_benjames_videostore_transcript.vtt
mainstreet005,355,00:30:46.320,00:30:46.830,Beau Newsome,Yes.,2021-05-19_benjames_videostore_transcript.vtt
mainstreet005,356,00:30:46.890,00:30:49.860,Ben James,"That was a good vision as well, Wolf.",2021-05-19_benjames_videostore_transcript.vtt
mainstreet005,357,00:30:50.670,00:30:58.050,Ben James,"story We have lots of tripods with which is great, but completely a different film altogether.",2021-05-19_benjames_videostore_transcript.vtt
mainstreet005,358,00:30:59.760,00:31:13.560,Ben James,"yeah so the horror class we try to do like a 20th century kind of like look at American history and then look at the horror films that are produced during these different areas, so it was when something like.",2021-05-19_benjames_videostore_transcript.vtt
mainstreet005,359,00:31:15.600,00:31:31.530,Ben James,"godzilla invasion of the body snatchers and the fly and then into the 60s, I think we skipped over psycho because I used it to teach in class so in the 60s, it was night of the living dead we looked at with the main film.",2021-05-19_benjames_videostore_transcript.vtt
mainstreet005,360,00:31:33.000,00:31:33.630,Ben James,And then.,2021-05-19_benjames_videostore_transcript.vtt
mainstreet005,361,00:31:34.800,00:31:41.760,Ben James,"You know it's tricky as well, because you kind of showing these films to like sophomores and some of them.",2021-05-19_benjames_videostore_transcript.vtt
mainstreet005,362,00:31:43.200,00:31:55.650,Ben James,"are more you know easily scared that you might think so you've got to chew in countries anything to to insane, so I think Joe was in the 70s, we watched jaws.",2021-05-19_benjames_videostore_transcript.vtt
mainstreet005,363,00:31:57.510,00:31:59.130,Beau Newsome,classic not show the.,2021-05-19_benjames_videostore_transcript.vtt
mainstreet005,364,00:32:00.210,00:32:00.780,Ben James,yeah.,2021-05-19_benjames_videostore_transcript.vtt
mainstreet005,365,00:32:00.930,00:32:02.850,Beau Newsome,not show the month.,2021-05-19_benjames_videostore_transcript.vtt
mainstreet005,366,00:32:02.910,00:32:03.090,Beau Newsome,I.,2021-05-19_benjames_videostore_transcript.vtt
mainstreet005,367,00:32:03.150,00:32:05.220,Ben James,kind of don't reveal the monster yeah.,2021-05-19_benjames_videostore_transcript.vtt
mainstreet005,368,00:32:05.340,00:32:08.340,Beau Newsome,"Mostly, because they don't they can't afford it right is that one.",2021-05-19_benjames_videostore_transcript.vtt
mainstreet005,369,00:32:08.340,00:32:10.710,Ben James,Right yeah right they wasn't working.,2021-05-19_benjames_videostore_transcript.vtt
mainstreet005,370,00:32:10.770,00:32:17.700,Ben James,"They got it they got it, and then they were like this the shark doesn't work like okay well keep working on it.",2021-05-19_benjames_videostore_transcript.vtt
mainstreet005,371,00:32:19.140,00:32:20.310,Beau Newsome,it's not showing it yeah.,2021-05-19_benjames_videostore_transcript.vtt
mainstreet005,372,00:32:20.670,00:32:24.750,Ben James,yeah so um yeah so we looked at that time.,2021-05-19_benjames_videostore_transcript.vtt
mainstreet005,373,00:32:25.980,00:32:30.390,Ben James,"birds, as well the hitchcock movie the birds I think that's a really interesting movie to study.",2021-05-19_benjames_videostore_transcript.vtt
mainstreet005,374,00:32:31.680,00:32:41.010,Ben James,In its context to like think about what's going on with like feminism and and obviously hitchcock's issues with women is pretty interesting.,2021-05-19_benjames_videostore_transcript.vtt
mainstreet005,375,00:32:42.840,00:32:49.890,Ben James,"Car car remember what we did for the 1980s, the 90s, we did a beginning a 90 day candyman.",2021-05-19_benjames_videostore_transcript.vtt
mainstreet005,376,00:32:50.910,00:32:51.690,Ben James,We need great.,2021-05-19_benjames_videostore_transcript.vtt
mainstreet005,377,00:32:51.750,00:32:53.520,Beau Newsome,At which they're remaking now to.,2021-05-19_benjames_videostore_transcript.vtt
mainstreet005,378,00:32:53.970,00:32:56.700,Ben James,"I know I really don't want to do that, but.",2021-05-19_benjames_videostore_transcript.vtt
mainstreet005,379,00:32:57.030,00:32:58.830,Beau Newsome,yeah i'm i've never been a fan of.,2021-05-19_benjames_videostore_transcript.vtt
mainstreet005,380,00:32:58.830,00:33:01.650,Beau Newsome,"remakes or sequels or anything like that, but.",2021-05-19_benjames_videostore_transcript.vtt
mainstreet005,381,00:33:01.830,00:33:09.540,Ben James,yeah but yeah candy mother regional Canada was so great and like during matter and super interesting.,2021-05-19_benjames_videostore_transcript.vtt
mainstreet005,382,00:33:13.290,00:33:15.480,Ben James,"into the board, so I guess or.",2021-05-19_benjames_videostore_transcript.vtt
mainstreet005,383,00:33:16.590,00:33:19.200,Ben James,"Something in between Oh, the Blair witch project.",2021-05-19_benjames_videostore_transcript.vtt
mainstreet005,384,00:33:20.130,00:33:20.430,Beau Newsome,yeah.,2021-05-19_benjames_videostore_transcript.vtt
mainstreet005,385,00:33:20.550,00:33:23.220,Beau Newsome,The Blair witch project first time that was.,2021-05-19_benjames_videostore_transcript.vtt
mainstreet005,386,00:33:23.250,00:33:24.330,Ben James,That was something oh yeah.,2021-05-19_benjames_videostore_transcript.vtt
mainstreet005,387,00:33:24.600,00:33:38.580,Ben James,"that's a that's a fast one I think would be to think about in terms of like the failure of technology, you know, like in this moment that technology is supposed to be like you know lording it over everything else that like.",2021-05-19_benjames_videostore_transcript.vtt
mainstreet005,388,00:33:38.580,00:33:47.970,Ben James,"You know, if we take this technologies, the forest and they can't really capture anything they don't really get any evidence that it's.",2021-05-19_benjames_videostore_transcript.vtt
mainstreet005,389,00:33:48.030,00:33:51.240,Ben James,kind of interesting in that yeah that way i'm.,2021-05-19_benjames_videostore_transcript.vtt
mainstreet005,390,00:33:52.530,00:33:53.790,Ben James,Cabin in the woods.,2021-05-19_benjames_videostore_transcript.vtt
mainstreet005,391,00:33:53.820,00:34:02.760,Ben James,I think we look at that just because it was fun and then there were all sorts of other things that I would reference in the classroom yeah so.,2021-05-19_benjames_videostore_transcript.vtt
mainstreet005,392,00:34:03.000,00:34:03.630,Ben James,"Right, you know.",2021-05-19_benjames_videostore_transcript.vtt
mainstreet005,393,00:34:04.350,00:34:06.390,Ben James,i'm a big fan of David David lynch.,2021-05-19_benjames_videostore_transcript.vtt
mainstreet005,394,00:34:07.740,00:34:08.850,Ben James,and,2021-05-19_benjames_videostore_transcript.vtt
mainstreet005,395,00:34:08.970,00:34:14.520,Ben James,i'm really interested in talking about like the psychology of the camera like the way that was the psychology of editing.,2021-05-19_benjames_videostore_transcript.vtt
mainstreet005,396,00:34:14.760,00:34:17.490,Beau Newsome,Why don't know if you would characterize eraserhead is.,2021-05-19_benjames_videostore_transcript.vtt
mainstreet005,397,00:34:17.940,00:34:20.070,Beau Newsome,A horror movie but it's certainly terrifying.,2021-05-19_benjames_videostore_transcript.vtt
mainstreet005,398,00:34:20.610,00:34:29.550,Ben James,it's terrifying yeah it's terrifying well I think that's it's a horror horror movies get I think classified by perhaps should get classified by their effect right.,2021-05-19_benjames_videostore_transcript.vtt
mainstreet005,399,00:34:29.850,00:34:33.420,Ben James,If they if that disturbing and you're watching her.,2021-05-19_benjames_videostore_transcript.vtt
mainstreet005,400,00:34:34.170,00:34:36.960,Beau Newsome,what's funny is I my niece and nephew or.,2021-05-19_benjames_videostore_transcript.vtt
mainstreet005,401,00:34:38.730,00:34:44.310,Beau Newsome,21 and 19 years old now and I tried to get them to watch the shining and.,2021-05-19_benjames_videostore_transcript.vtt
mainstreet005,402,00:34:44.610,00:34:45.240,Ben James,Of course.,2021-05-19_benjames_videostore_transcript.vtt
mainstreet005,403,00:34:45.330,00:34:47.400,Beau Newsome,john carpenter's Halloween and they were just.,2021-05-19_benjames_videostore_transcript.vtt
mainstreet005,404,00:34:47.400,00:34:53.580,Beau Newsome,Like what like this isn't scary like this is boring not scary and I was.,2021-05-19_benjames_videostore_transcript.vtt
mainstreet005,405,00:34:53.610,00:34:54.180,Ben James,shining.,2021-05-19_benjames_videostore_transcript.vtt
mainstreet005,406,00:34:54.840,00:34:58.560,Ben James,sun is shining bright shining is a great movie it's great.,2021-05-19_benjames_videostore_transcript.vtt
mainstreet005,407,00:34:59.100,00:35:01.710,Beau Newsome,But it was just it was just seemed to be lost on a.,2021-05-19_benjames_videostore_transcript.vtt
mainstreet005,408,00:35:02.280,00:35:07.020,Beau Newsome,lost on them anyways because they were used to more in your face Gore kind of.,2021-05-19_benjames_videostore_transcript.vtt
mainstreet005,409,00:35:07.050,00:35:10.140,Beau Newsome,stuff right yeah oh yeah we did we looked at the.,2021-05-19_benjames_videostore_transcript.vtt
mainstreet005,410,00:35:10.140,00:35:12.180,Ben James,"saw movies, yes.",2021-05-19_benjames_videostore_transcript.vtt
mainstreet005,411,00:35:12.570,00:35:13.020,Beau Newsome,yeah that's a.,2021-05-19_benjames_videostore_transcript.vtt
mainstreet005,412,00:35:13.650,00:35:21.570,Ben James,Pretty interesting to think about in terms of like you know because they all the saw movies come out at the same time is like the war on terror is happening.,2021-05-19_benjames_videostore_transcript.vtt
mainstreet005,413,00:35:22.140,00:35:31.860,Ben James,And so there's like these interesting kind of parallels between like torture in in like American culture and torture that's pretty interesting.,2021-05-19_benjames_videostore_transcript.vtt
mainstreet005,414,00:35:33.690,00:35:41.040,Beau Newsome,"Did you notice, if your students knew a lot about Howard Hughes are released surprised when he said, there was a video store downtown.",2021-05-19_benjames_videostore_transcript.vtt
mainstreet005,415,00:35:41.700,00:35:51.540,Ben James,"I think they were surprised, they were most they're pretty surprised, most of the time you know I think I was, I was a pusher for the for the video store for sure definitely.",2021-05-19_benjames_videostore_transcript.vtt
mainstreet005,416,00:35:51.600,00:35:52.830,Beau Newsome,yeah that really helps.,2021-05-19_benjames_videostore_transcript.vtt
mainstreet005,417,00:35:52.950,00:35:55.350,Ben James,A lot go and get some go and get videos.,2021-05-19_benjames_videostore_transcript.vtt
mainstreet005,418,00:35:55.470,00:35:55.890,Beau Newsome,yeah I.,2021-05-19_benjames_videostore_transcript.vtt
mainstreet005,419,00:35:55.920,00:36:05.280,Beau Newsome,tried to coordinate with with you and some other professors that did some movie classes and stuff I know one Professor did a mammoth mammoth.,2021-05-19_benjames_videostore_transcript.vtt
mainstreet005,420,00:36:05.760,00:36:06.360,Ben James,Oh yeah.,2021-05-19_benjames_videostore_transcript.vtt
mainstreet005,421,00:36:06.420,00:36:07.440,Beau Newsome,movie class and.,2021-05-19_benjames_videostore_transcript.vtt
mainstreet005,422,00:36:08.340,00:36:11.040,Beau Newsome,it's I try to get as my list of whatever.,2021-05-19_benjames_videostore_transcript.vtt
mainstreet005,423,00:36:12.240,00:36:17.040,Beau Newsome,The Professor was showing so I could maybe order a few more copies or make sure we have enough.,2021-05-19_benjames_videostore_transcript.vtt
mainstreet005,424,00:36:17.040,00:36:17.250,Ben James,On.,2021-05-19_benjames_videostore_transcript.vtt
mainstreet005,425,00:36:17.310,00:36:17.880,Beau Newsome,Our end and.,2021-05-19_benjames_videostore_transcript.vtt
mainstreet005,426,00:36:18.270,00:36:22.980,Beau Newsome,"yeah it was good, it was there was always a fine line of getting enough students into our store.",2021-05-19_benjames_videostore_transcript.vtt
mainstreet005,427,00:36:23.130,00:36:23.550,,You know.,2021-05-19_benjames_videostore_transcript.vtt
mainstreet005,428,00:36:24.600,00:36:25.110,Ben James,Yes.,2021-05-19_benjames_videostore_transcript.vtt
mainstreet005,429,00:36:25.140,00:36:27.900,Beau Newsome,It was mostly miss but we'd hit every once awhile but.,2021-05-19_benjames_videostore_transcript.vtt
mainstreet005,430,00:36:29.220,00:36:32.400,Beau Newsome,Mostly miss out on a lot of students coming into our store.,2021-05-19_benjames_videostore_transcript.vtt
mainstreet005,431,00:36:33.120,00:36:34.920,Ben James,that's too bad it's too bad.,2021-05-19_benjames_videostore_transcript.vtt
mainstreet005,432,00:36:36.180,00:36:36.600,Ben James,yeah.,2021-05-19_benjames_videostore_transcript.vtt
mainstreet005,433,00:36:38.850,00:36:46.290,Ben James,I think that about covers yeah most of the horror stuff that the shining was like a core thing for me just like talking about the way that.,2021-05-19_benjames_videostore_transcript.vtt
mainstreet005,434,00:36:47.670,00:36:55.620,Ben James,"The genre functions, the shining is you can use that to to teach a lot of different things about their about their genre so it's a pretty handy film.",2021-05-19_benjames_videostore_transcript.vtt
mainstreet005,435,00:36:56.400,00:37:00.630,Beau Newsome,"yeah it's one of my favorite horror movies, of all time.",2021-05-19_benjames_videostore_transcript.vtt
mainstreet005,436,00:37:02.760,00:37:13.170,Beau Newsome,"One that stands out, I had the benefit of going to the sundance film festival couple years ago before the pandemic, but I got to see heredity.",2021-05-19_benjames_videostore_transcript.vtt
mainstreet005,437,00:37:14.070,00:37:14.910,Ben James,Oh brilliant.,2021-05-19_benjames_videostore_transcript.vtt
mainstreet005,438,00:37:15.030,00:37:19.440,Beau Newsome,"Well, as a really well received movie.",2021-05-19_benjames_videostore_transcript.vtt
mainstreet005,439,00:37:20.160,00:37:24.990,Ben James,yeah yeah I I I love that movie I think it's so.,2021-05-19_benjames_videostore_transcript.vtt
mainstreet005,440,00:37:28.800,00:37:30.750,Ben James,The ending is.,2021-05-19_benjames_videostore_transcript.vtt
mainstreet005,441,00:37:32.310,00:37:36.480,Ben James,"I don't I don't know what else it could be, I think.",2021-05-19_benjames_videostore_transcript.vtt
mainstreet005,442,00:37:36.750,00:37:41.610,Ben James,The thing that I have a slightly frustrating about it because it's so it's so great.,2021-05-19_benjames_videostore_transcript.vtt
mainstreet005,443,00:37:43.140,00:37:44.850,Ben James,I think it's I think it's.,2021-05-19_benjames_videostore_transcript.vtt
mainstreet005,444,00:37:46.410,00:37:47.940,Ben James,"really, really, really well done.",2021-05-19_benjames_videostore_transcript.vtt
mainstreet005,445,00:37:48.240,00:37:52.530,Beau Newsome,yeah Those are the two heredity and the which stand out and being like em.,2021-05-19_benjames_videostore_transcript.vtt
mainstreet005,446,00:37:52.740,00:37:53.670,Beau Newsome,And Baba Dick.,2021-05-19_benjames_videostore_transcript.vtt
mainstreet005,447,00:37:54.600,00:37:55.080,Ben James,yeah it was.,2021-05-19_benjames_videostore_transcript.vtt
mainstreet005,448,00:37:56.190,00:37:57.630,Ben James,It was a banner period that.,2021-05-19_benjames_videostore_transcript.vtt
mainstreet005,449,00:37:57.630,00:37:58.650,Beau Newsome,yeah it was it was like.,2021-05-19_benjames_videostore_transcript.vtt
mainstreet005,450,00:37:59.070,00:38:01.860,Ben James,"movies Okay, I was just like all right yeah.",2021-05-19_benjames_videostore_transcript.vtt
mainstreet005,451,00:38:02.580,00:38:04.380,Beau Newsome,here's a rebirth of kind of these.,2021-05-19_benjames_videostore_transcript.vtt
mainstreet005,452,00:38:04.890,00:38:06.300,Beau Newsome,These horror movie it's always.,2021-05-19_benjames_videostore_transcript.vtt
mainstreet005,453,00:38:06.540,00:38:08.010,Beau Newsome,been there with the paranormal.,2021-05-19_benjames_videostore_transcript.vtt
mainstreet005,454,00:38:08.430,00:38:09.900,Beau Newsome,Activity stuff but.,2021-05-19_benjames_videostore_transcript.vtt
mainstreet005,455,00:38:10.260,00:38:16.410,Ben James,Right yeah one of my friends and rena was in that movie actually she was she was in the first one.,2021-05-19_benjames_videostore_transcript.vtt
mainstreet005,456,00:38:17.520,00:38:17.970,Beau Newsome,Which one.,2021-05-19_benjames_videostore_transcript.vtt
mainstreet005,457,00:38:19.110,00:38:20.310,Ben James,In the first paranormal.,2021-05-19_benjames_videostore_transcript.vtt
