objectid,transcript_line,start,end,speaker,text,txt_filename
mainstreet035,133,00:14:20.400,00:14:21.630,Courtney Berge,Main Street video co op.,2021-07-02_courtneyberge_videostore_transcript.vtt
mainstreet035,134,00:14:21.900,00:14:22.440,Courtney Berge,Yes.,2021-07-02_courtneyberge_videostore_transcript.vtt
mainstreet035,135,00:14:22.470,00:14:23.820,Courtney Berge,forever known as Howard Hughes.,2021-07-02_courtneyberge_videostore_transcript.vtt
mainstreet035,136,00:14:23.820,00:14:30.270,Monique Lillard,"forever out exactly exactly and do you think oh my gosh it's still there, or or.",2021-07-02_courtneyberge_videostore_transcript.vtt
mainstreet035,137,00:14:30.300,00:14:31.020,Courtney Berge,I was like.,2021-07-02_courtneyberge_videostore_transcript.vtt
mainstreet035,138,00:14:31.320,00:14:33.810,Courtney Berge,"Oh, they changed the name that's weird.",2021-07-02_courtneyberge_videostore_transcript.vtt
mainstreet035,139,00:14:34.950,00:14:48.120,Courtney Berge,"I feel like I remember it changing hands of ownership at some point and but it stayed Howard Hughes, and so I didn't know what had happened between that and it becoming the video co op.",2021-07-02_courtneyberge_videostore_transcript.vtt
mainstreet035,140,00:14:49.020,00:14:56.400,Courtney Berge,And then I think later someone was like oh it's still the same it's just a Co op now right right right.,2021-07-02_courtneyberge_videostore_transcript.vtt
mainstreet035,141,00:14:59.400,00:15:03.570,Monique Lillard,So that co op kind of the change didn't affect you much.,2021-07-02_courtneyberge_videostore_transcript.vtt
mainstreet035,142,00:15:04.380,00:15:11.970,Courtney Berge,"Know except the five for five for five and turn into a 547 for seven and I had a hard time, remembering that phrase like I got it.",2021-07-02_courtneyberge_videostore_transcript.vtt
mainstreet035,143,00:15:12.360,00:15:27.810,Courtney Berge,was like when I remember going in and be like Do you still do the 54545 and they're like it's 54747 so i'm like now break that down for me five movies for seven days for $5 like know or like.,2021-07-02_courtneyberge_videostore_transcript.vtt
mainstreet035,144,00:15:30.120,00:15:30.330,Courtney Berge,Right.,2021-07-02_courtneyberge_videostore_transcript.vtt
mainstreet035,145,00:15:31.170,00:15:34.740,Monique Lillard,I confess that was my idea that they raise those prices.,2021-07-02_courtneyberge_videostore_transcript.vtt
mainstreet035,146,00:15:35.700,00:15:38.610,Courtney Berge,"An idea, it just doesn't roll off the Tongue quite.",2021-07-02_courtneyberge_videostore_transcript.vtt
mainstreet035,147,00:15:40.620,00:15:45.480,Monique Lillard,They probably could have done 74747 and probably at about the same profit so come to think of it.,2021-07-02_courtneyberge_videostore_transcript.vtt
mainstreet035,148,00:15:46.950,00:15:47.910,Monique Lillard,should have talked to you that.,2021-07-02_courtneyberge_videostore_transcript.vtt
mainstreet035,149,00:15:48.960,00:15:49.230,Monique Lillard,that's.,2021-07-02_courtneyberge_videostore_transcript.vtt
mainstreet035,150,00:15:49.260,00:15:50.340,Courtney Berge,I wasn't around.,2021-07-02_courtneyberge_videostore_transcript.vtt
mainstreet035,151,00:15:51.630,00:15:54.930,Monique Lillard,"Did you become an owner of the co op it, you know or.",2021-07-02_courtneyberge_videostore_transcript.vtt
mainstreet035,152,00:15:55.500,00:16:15.090,Courtney Berge,"I did, I did not, I remember getting asked one time if I was an owner and I said no, and then I asked what it was, and they said it was $200, but I could pay in installments and I was like not today, but maybe someday and then I was going to do it.",2021-07-02_courtneyberge_videostore_transcript.vtt
mainstreet035,153,00:16:15.780,00:16:31.200,Courtney Berge,"Actually right around I was like next time I get a movie i'm going to start this and then they close down which I gotta say i'm kind of glad I did it at that point cuz, then it would have basically $200 out of the.",2021-07-02_courtneyberge_videostore_transcript.vtt
mainstreet035,154,00:16:32.220,00:16:32.580,Courtney Berge,sure.,2021-07-02_courtneyberge_videostore_transcript.vtt
mainstreet035,155,00:16:33.870,00:16:34.920,Courtney Berge,or nothing but.,2021-07-02_courtneyberge_videostore_transcript.vtt
mainstreet035,156,00:16:34.920,00:16:35.880,Monique Lillard,yeah yeah.,2021-07-02_courtneyberge_videostore_transcript.vtt
mainstreet035,157,00:16:38.970,00:16:47.100,Monique Lillard,"Okay now there's a whole lot of interesting things that all of this, so you come back here in 2017 at that point, how often do you go to the video store.",2021-07-02_courtneyberge_videostore_transcript.vtt
mainstreet035,158,00:16:49.980,00:17:06.780,Courtney Berge,"um I would probably go every few months in 2017 i'm 2018 or 19 or this probably about the same I go every few months and I get five movies um but, in the last.",2021-07-02_courtneyberge_videostore_transcript.vtt
mainstreet035,159,00:17:07.860,00:17:20.280,Courtney Berge,"The year or so before it closed, it was like my husband, and I would go downtown for dinner for like a date night and we've just be walking downtown and i'd be like let's rent movies.",2021-07-02_courtneyberge_videostore_transcript.vtt
mainstreet035,160,00:17:21.330,00:17:26.460,Courtney Berge,So that was kind of part of the like the day um.,2021-07-02_courtneyberge_videostore_transcript.vtt
mainstreet035,161,00:17:28.020,00:17:38.070,Courtney Berge,But now we can't do that and it makes me sad I probably would have gotten more honestly throughout the time except they weren't ever open during Saturday market.,2021-07-02_courtneyberge_videostore_transcript.vtt
mainstreet035,162,00:17:38.730,00:17:56.340,Courtney Berge,"which was when I was downtown because it was always a while i'm downtown i'll get movies, not i'm going to go get movies um and so when they were never opened during market, which was one of the few times I went to downtown I didn't have the opportunity to.",2021-07-02_courtneyberge_videostore_transcript.vtt
mainstreet035,163,00:17:58.170,00:17:58.560,Courtney Berge,You know.,2021-07-02_courtneyberge_videostore_transcript.vtt
mainstreet035,164,00:17:58.860,00:18:04.290,Monique Lillard,"that's interesting because I was on the cooperative board Maybe I should have said that beginning I was, I was.",2021-07-02_courtneyberge_videostore_transcript.vtt
mainstreet035,165,00:18:04.950,00:18:12.720,Monique Lillard,"an officer in the cooperative board at the beginning and oh my gosh we went back and forth so many times, because a lot of people like.",2021-07-02_courtneyberge_videostore_transcript.vtt
mainstreet035,166,00:18:13.230,00:18:21.630,Monique Lillard,"me and lots said, you know that's when people are there, and if we're going to have these weekly Rentals then people aren't going to worry about their late fees and.",2021-07-02_courtneyberge_videostore_transcript.vtt
mainstreet035,167,00:18:22.260,00:18:35.040,Monique Lillard,"But then the problem was, of course, you have to pay someone to be at the store and so being open had to at least pay their salary and unfortunately it wasn't a clear moneymaker.",2021-07-02_courtneyberge_videostore_transcript.vtt
mainstreet035,168,00:18:35.250,00:18:44.850,Monique Lillard,"Yes, put it that way, so that's what was going on now, so your husband was he surprised that there were still a video store data always see from here.",2021-07-02_courtneyberge_videostore_transcript.vtt
mainstreet035,169,00:18:45.060,00:18:46.980,Courtney Berge,he's not I met him at Miller.,2021-07-02_courtneyberge_videostore_transcript.vtt
mainstreet035,170,00:18:47.790,00:18:49.080,Courtney Berge,He was surprised.,2021-07-02_courtneyberge_videostore_transcript.vtt
mainstreet035,171,00:18:50.430,00:18:55.050,Courtney Berge,He was he was like oh that's cool I don't know exact thoughts.,2021-07-02_courtneyberge_videostore_transcript.vtt
mainstreet035,172,00:18:56.070,00:19:14.130,Courtney Berge,"But our trips went from me picking out, I had to give up a few of my slots in the five two things that he would like, which was always a bit of a challenge, because I have like I had a method about how I did it um.",2021-07-02_courtneyberge_videostore_transcript.vtt
mainstreet035,173,00:19:14.160,00:19:15.120,Monique Lillard,What was your method.,2021-07-02_courtneyberge_videostore_transcript.vtt
mainstreet035,174,00:19:16.380,00:19:23.790,Courtney Berge,"So I would always i'd go in and I have like my favorite sections, or whatever, and I get at least one classic.",2021-07-02_courtneyberge_videostore_transcript.vtt
mainstreet035,175,00:19:25.230,00:19:37.440,Courtney Berge,"One animated thing and one TV show the TV show wasn't an every time, but like I would try to get a TV show, and then I would get a cold classic.",2021-07-02_courtneyberge_videostore_transcript.vtt
mainstreet035,176,00:19:38.130,00:19:56.610,Courtney Berge,"um and then there was like a random card one, but I always tried to get things and I always split it up between things that I knew I liked because sometimes i'd go in, because I wanted to watch a specific movie and then, once I had never seen that looked interesting.",2021-07-02_courtneyberge_videostore_transcript.vtt
mainstreet035,177,00:19:59.970,00:20:05.010,Monique Lillard,"And through all this time, taking from 2017 did you do, you also use streaming services.",2021-07-02_courtneyberge_videostore_transcript.vtt
mainstreet035,178,00:20:05.400,00:20:06.480,Courtney Berge,"Yes, yeah.",2021-07-02_courtneyberge_videostore_transcript.vtt
mainstreet035,179,00:20:06.630,00:20:09.570,Monique Lillard,"And I assume you're also going to the movies, from time to time in the theater.",2021-07-02_courtneyberge_videostore_transcript.vtt
mainstreet035,180,00:20:10.230,00:20:21.960,Courtney Berge,Not as much and got expensive and i'm cheap that's okay um if there was a movie That was really good I might see it in theaters.,2021-07-02_courtneyberge_videostore_transcript.vtt
mainstreet035,181,00:20:22.590,00:20:41.220,Courtney Berge,"If not i'd wait to see if it went into the kenworthy and then i'd go see it and that's how I saw like most of the marvel movies, because i'm not very into the marvel movies, but i'd pay $6 to go see one versus like 12 or whatever it was at that time.",2021-07-02_courtneyberge_videostore_transcript.vtt
mainstreet035,182,00:20:43.410,00:20:57.330,Courtney Berge,"And I sweet I don't we only had netflix for a very long time, and now we have well within my family, we have netflix Amazon prime and Disney plus oh.",2021-07-02_courtneyberge_videostore_transcript.vtt
mainstreet035,183,00:20:58.950,00:21:04.410,Courtney Berge,"yeah air variety, but I don't particularly like them, but yeah.",2021-07-02_courtneyberge_videostore_transcript.vtt
mainstreet035,184,00:21:05.550,00:21:05.910,Courtney Berge,yeah.,2021-07-02_courtneyberge_videostore_transcript.vtt
mainstreet035,185,00:21:06.960,00:21:19.500,Monique Lillard,"Do you think, having and I hear you saying that and I understand the fat sort of family sharing, but do you think it saves money to do the streaming or did it was it essentially cheaper to do the video store.",2021-07-02_courtneyberge_videostore_transcript.vtt
mainstreet035,186,00:21:21.000,00:21:39.720,Courtney Berge,"I think when netflix first started, I think, when it was the only streaming movie I think it was cheaper, I remember having to convince my dad to get it, because he was not convinced that we would use it worth 899 a month.",2021-07-02_courtneyberge_videostore_transcript.vtt
mainstreet035,187,00:21:41.100,00:22:02.340,Courtney Berge,I think we proved him wrong in that because we did use it much more um but now because there's so many and there's fewer video Rentals so you can't go as easily and get like a DVD people who get them all it's it's just cable it's all.,2021-07-02_courtneyberge_videostore_transcript.vtt
mainstreet035,188,00:22:03.930,00:22:05.430,Courtney Berge,This cable yeah yeah.,2021-07-02_courtneyberge_videostore_transcript.vtt
mainstreet035,189,00:22:07.350,00:22:15.180,Monique Lillard,"Do you ever take videos home from the library, where you work at the University of Idaho or from the Moscow public.",2021-07-02_courtneyberge_videostore_transcript.vtt
mainstreet035,190,00:22:15.570,00:22:19.260,Courtney Berge,"I have recently in the last few weeks, actually.",2021-07-02_courtneyberge_videostore_transcript.vtt
mainstreet035,191,00:22:21.360,00:22:27.630,Courtney Berge,"I went up on one of my breaks, because a friend and I have been working through twin peaks.",2021-07-02_courtneyberge_videostore_transcript.vtt
mainstreet035,192,00:22:29.610,00:22:36.120,Courtney Berge,"Does one of the movies, that are the shows I first watched from Howard Hughes I watched the first season.",2021-07-02_courtneyberge_videostore_transcript.vtt
mainstreet035,193,00:22:36.540,00:22:48.420,Courtney Berge,"And I couldn't get through the second season and then I watched it on netflix the first season and I couldn't get through the second season and then I co opted, a friend and was like I want to watch all of it.",2021-07-02_courtneyberge_videostore_transcript.vtt
mainstreet035,194,00:22:49.530,00:23:09.360,Courtney Berge,"So now i've watched the first and second season, the movie and we've started the 2016 17 reboot, and so I needed the next desk for the reboot, and so I went off and I did some browsing on the you have I shells and I walked out with four movies, I think, oh okay.",2021-07-02_courtneyberge_videostore_transcript.vtt
mainstreet035,195,00:23:09.390,00:23:13.530,Monique Lillard,Including that that reboot of twin peaks yeah excellent some of these.,2021-07-02_courtneyberge_videostore_transcript.vtt
mainstreet035,196,00:23:13.590,00:23:14.610,Courtney Berge,And I want you to read.,2021-07-02_courtneyberge_videostore_transcript.vtt
mainstreet035,197,00:23:15.690,00:23:16.440,Courtney Berge,Before they weren't.,2021-07-02_courtneyberge_videostore_transcript.vtt
mainstreet035,198,00:23:17.400,00:23:18.900,Monique Lillard,When you said.,2021-07-02_courtneyberge_videostore_transcript.vtt
mainstreet035,199,00:23:20.490,00:23:23.010,Monique Lillard,You couldn't get through them in what sense.,2021-07-02_courtneyberge_videostore_transcript.vtt
mainstreet035,200,00:23:23.700,00:23:33.930,Courtney Berge,twin peaks me and my friend have talked a lot about this on the first season's like eight episodes and it's great but it's weird it's David lynch.,2021-07-02_courtneyberge_videostore_transcript.vtt
mainstreet035,201,00:23:34.470,00:23:40.290,Courtney Berge,um it's very melodramatic kind of slow moving and the music trust blares up at points.,2021-07-02_courtneyberge_videostore_transcript.vtt
mainstreet035,202,00:23:40.920,00:23:49.380,Courtney Berge,"And I could get through the eight episodes but then I would like, want to take a break, before starting the second season, but if there's memory to us.",2021-07-02_courtneyberge_videostore_transcript.vtt
mainstreet035,203,00:23:49.920,00:24:00.960,Courtney Berge,"On twin peaks that you'll watch an episode and completely forget everything that happened in the previous episode, so you can't let enough time pass.",2021-07-02_courtneyberge_videostore_transcript.vtt
mainstreet035,204,00:24:01.860,00:24:18.570,Courtney Berge,"before you start the second season cuz, then you forgotten everything that happened or seemed important in the first season, and so I would let too much time pass and I couldn't remember who the characters are what their relationships were or anything.",2021-07-02_courtneyberge_videostore_transcript.vtt
mainstreet035,205,00:24:20.550,00:24:33.270,Courtney Berge,"And, like every time we would meet, because we would meet weekly this last year, we met weekly to to watch some episodes and every week we'd be like all right now, what happened last week.",2021-07-02_courtneyberge_videostore_transcript.vtt
mainstreet035,206,00:24:36.510,00:24:38.460,Courtney Berge,So funny yeah.,2021-07-02_courtneyberge_videostore_transcript.vtt
mainstreet035,207,00:24:40.320,00:24:44.820,Monique Lillard,Is it had you been watching a lot of other shows or was it just something about.,2021-07-02_courtneyberge_videostore_transcript.vtt
mainstreet035,208,00:24:44.850,00:24:50.190,Courtney Berge,I think it's just something about how the story is told in twin peaks.,2021-07-02_courtneyberge_videostore_transcript.vtt
mainstreet035,209,00:24:50.520,00:24:57.570,Monique Lillard,that's interesting and i'll play the age card here because I watched twin peaks when it was airing right and.,2021-07-02_courtneyberge_videostore_transcript.vtt
mainstreet035,210,00:24:59.160,00:25:11.910,Monique Lillard,"Everybody was talking about it and so everybody would keep talking about it all week long and calling each other, did you see this, and can you believe this and oh man wasn't weird when she suddenly looking at a plate of creamed corn, remember that.",2021-07-02_courtneyberge_videostore_transcript.vtt
mainstreet035,211,00:25:12.900,00:25:26.760,Monique Lillard,"And Oh, can you believe this, and this, and I think that that probably kept it alive for us, you know, and then I remember, I must have replayed sometime and I taped it using my vcr.",2021-07-02_courtneyberge_videostore_transcript.vtt
mainstreet035,212,00:25:27.900,00:25:36.360,Monique Lillard,"And then my I got married and my husband found that I think he was sick with the flu, or something and so he's binge watching using my homemade vhs.",2021-07-02_courtneyberge_videostore_transcript.vtt
mainstreet035,213,00:25:38.070,00:25:41.550,Monique Lillard,"And i'd forgotten to take the last episode, or it got taped over something.",2021-07-02_courtneyberge_videostore_transcript.vtt
mainstreet035,214,00:25:42.120,00:25:50.550,Monique Lillard,"he's still doesn't forgive me he's still insist he's never seen it and I said i've rented it, you have seen it, but I think he said what you said, he said, like you, can't just play me the last episode.",2021-07-02_courtneyberge_videostore_transcript.vtt
mainstreet035,215,00:25:50.820,00:25:56.220,Monique Lillard,i'm gonna have to invest all that time now to watch the whole thing so maybe he hasn't seen it I don't know.,2021-07-02_courtneyberge_videostore_transcript.vtt
mainstreet035,216,00:25:57.480,00:25:59.640,Courtney Berge,And after watching the movie.,2021-07-02_courtneyberge_videostore_transcript.vtt
mainstreet035,217,00:26:00.690,00:26:05.310,Courtney Berge,And stuff and I haven't watched a lot of David lynch if any um.,2021-07-02_courtneyberge_videostore_transcript.vtt
mainstreet035,218,00:26:06.180,00:26:21.630,Courtney Berge,"I feel like he just likes to open things and never address them and i'm like did you intend to go back I don't know with the movie he people just disappear and you're like what happened to that guy, why was David Bowie in this for like a second and then just gone.",2021-07-02_courtneyberge_videostore_transcript.vtt
mainstreet035,219,00:26:24.240,00:26:27.480,Monique Lillard,"Oh, you need to see blue velvet have you seen blue velvet.",2021-07-02_courtneyberge_videostore_transcript.vtt
mainstreet035,220,00:26:27.570,00:26:33.090,Courtney Berge,i've seen the intro because I took a film class and they showed the intro and part of the film class.,2021-07-02_courtneyberge_videostore_transcript.vtt
mainstreet035,221,00:26:33.900,00:26:46.500,Monique Lillard,Extremely creepy weird movie i've been assured by a movie buff that it's about spokane this person who said this was a spokane native and he's now actually the movie reviewer for the salt lake tribune.,2021-07-02_courtneyberge_videostore_transcript.vtt
mainstreet035,222,00:26:47.160,00:26:53.790,Monique Lillard,And he's the one who loved David lynch and got me watching this whole thing and very weird movie.,2021-07-02_courtneyberge_videostore_transcript.vtt
mainstreet035,223,00:26:54.420,00:26:55.350,Courtney Berge,I don't doubt it.,2021-07-02_courtneyberge_videostore_transcript.vtt
mainstreet035,224,00:26:56.730,00:27:04.200,Courtney Berge,was when I was watching the twin peaks movie I looked up David lynch's kind of like biography cuz I was like it's so weird to watch a movie.,2021-07-02_courtneyberge_videostore_transcript.vtt
mainstreet035,225,00:27:04.650,00:27:24.990,Courtney Berge,"Where someone says Oh, he flew in from spokane with like, no question of where spokane is no like huh because, like in TV you'll see like he's from Seattle or portland but you're not going to get like a spokane you might get a Boise but not.",2021-07-02_courtneyberge_videostore_transcript.vtt
mainstreet035,226,00:27:26.400,00:27:27.510,Courtney Berge,Not often.,2021-07-02_courtneyberge_videostore_transcript.vtt
mainstreet035,227,00:27:28.560,00:27:28.950,Courtney Berge,So.,2021-07-02_courtneyberge_videostore_transcript.vtt
mainstreet035,228,00:27:29.610,00:27:39.060,Courtney Berge,"I looked at it and I was like ah, he was born in missoula lived in spokane lived in sandpoint lived maybe in Boise and I remember.",2021-07-02_courtneyberge_videostore_transcript.vtt
mainstreet035,229,00:27:40.290,00:27:46.230,Monique Lillard,"Right exactly yes, yes, and his cousin lives here in town as a matter of fact, but while we'll talk about that.",2021-07-02_courtneyberge_videostore_transcript.vtt
mainstreet035,230,00:27:46.260,00:27:47.430,Courtney Berge,After we stopped recording.,2021-07-02_courtneyberge_videostore_transcript.vtt
mainstreet035,231,00:27:47.490,00:27:48.960,Monique Lillard,How about that any.,2021-07-02_courtneyberge_videostore_transcript.vtt
mainstreet035,232,00:27:54.630,00:28:05.070,Monique Lillard,"Any thoughts about changes in the store itself over the years, so you're starting as a little girl and, of course, your perspective is changing you're getting literally taller and obviously more grown up.",2021-07-02_courtneyberge_videostore_transcript.vtt
mainstreet035,233,00:28:05.790,00:28:10.380,Monique Lillard,all the way through to the end just what the inside felt like what the conversations were like.,2021-07-02_courtneyberge_videostore_transcript.vtt
mainstreet035,234,00:28:11.880,00:28:29.760,Courtney Berge,"I remember not liking it when it moved to mainstream because they got rid of the wall of the actors wall of fame and stuff which now I understand they just didn't have space for like I get it, but I still missed that a lot um.",2021-07-02_courtneyberge_videostore_transcript.vtt
mainstreet035,235,00:28:31.980,00:28:38.310,Courtney Berge,"Other than that, I don't remember a lot of changes I remember.",2021-07-02_courtneyberge_videostore_transcript.vtt
mainstreet035,236,00:28:41.520,00:28:42.870,Courtney Berge,I remember that there was like.,2021-07-02_courtneyberge_videostore_transcript.vtt
mainstreet035,237,00:28:44.430,00:28:53.460,Courtney Berge,"I remember noticing I think when like the adult section disappeared, because, like a curtain went away in the movie section expanded or not, the movie the TV section expanded, I think.",2021-07-02_courtneyberge_videostore_transcript.vtt
mainstreet035,238,00:28:54.510,00:28:55.260,Courtney Berge,um.,2021-07-02_courtneyberge_videostore_transcript.vtt
mainstreet035,239,00:28:56.340,00:29:04.170,Courtney Berge,But not a lot I certain sections changed over the times like there were the staples you had your comedy or drama your foreign your new releases.,2021-07-02_courtneyberge_videostore_transcript.vtt
mainstreet035,240,00:29:05.790,00:29:13.170,Courtney Berge,They got a British TV section and I don't know when that popped up but I remember recognizing when it popped up and being like oh that's new.,2021-07-02_courtneyberge_videostore_transcript.vtt
mainstreet035,241,00:29:14.400,00:29:22.590,Courtney Berge,They got like a star trek specific section that may have been there and maybe they moved it they got a ghibli studio section.,2021-07-02_courtneyberge_videostore_transcript.vtt
mainstreet035,242,00:29:24.450,00:29:24.870,Courtney Berge,But.,2021-07-02_courtneyberge_videostore_transcript.vtt
mainstreet035,243,00:29:26.760,00:29:35.910,Courtney Berge,Not a lot of like physical or even like atmospheric changes I feel like because I was so little when it was on fifth street like.,2021-07-02_courtneyberge_videostore_transcript.vtt
mainstreet035,244,00:29:39.900,00:29:45.840,Courtney Berge,I didn't pay much attention to that I was just there looking to look for the movies.,2021-07-02_courtneyberge_videostore_transcript.vtt
mainstreet035,245,00:29:48.330,00:30:04.170,Courtney Berge,"But I liked the space on Main Street, the more is more time I got to spend there and I don't know if that's just because well, I mean it was there there's nothing I could do to change it, so I just accepted it and moved on and let my grudge of the wall of fame be.",2021-07-02_courtneyberge_videostore_transcript.vtt
mainstreet035,246,00:30:05.310,00:30:06.840,Courtney Berge,go away and.,2021-07-02_courtneyberge_videostore_transcript.vtt
mainstreet035,247,00:30:08.130,00:30:13.890,Courtney Berge,Just accepted the staff PICs as my new like wall of fame i'm.,2021-07-02_courtneyberge_videostore_transcript.vtt
mainstreet035,248,00:30:14.010,00:30:16.230,Monique Lillard,"i'm right there with you, I completely agree.",2021-07-02_courtneyberge_videostore_transcript.vtt
mainstreet035,249,00:30:17.490,00:30:22.410,Courtney Berge,um but I always felt like it was a fun space I liked how they had.,2021-07-02_courtneyberge_videostore_transcript.vtt
mainstreet035,250,00:30:23.460,00:30:27.660,Courtney Berge,"The little section, like the stairs up like because it was multi tiered.",2021-07-02_courtneyberge_videostore_transcript.vtt
mainstreet035,251,00:30:29.370,00:30:39.720,Courtney Berge,"The old space or the streets place I all I remember, is it was on like one floor and then there was like a little ramp or a couple stairs that went up to the other side of the store.",2021-07-02_courtneyberge_videostore_transcript.vtt
